date,title,text,source_name,sentiment,tickers,topics,url
2024-11-21,Nvidia H200 Is The Fastest Product Ramp-Up In History,"Nvidia Corporation reported 93.6% revenue growth and 101.4% year-over-year growth in adjusted operating profits, driven by strong data center demand and AI computing. The H200 sales reached double-digit billions, marking the fastest product ramp in Nvidia's history, with strong partnerships in the AI ecosystem. Nvidia is guiding for $37.5 billion revenue for Q4, with an anticipated 111% revenue growth in FY25, driven by data center and automotive segments.",Seeking Alpha,Positive,NVDA,paylimitwall,https://seekingalpha.com/article/4739383-nvidia-h200-is-the-fastest-product-ramp-up-in-history
2024-11-21,"Dow and S&P 500 rise; Nasdaq dips as Alphabet, NVIDIA fall and Snowflake jumps 30%","The Dow Jones Industrial Average surged 544 points (1.25%) on Thursday, while the S&P 500 gained 0.5%, buoyed by investor interest in cyclical stocks expected to thrive in a growing economy. In contrast, the Nasdaq Composite dipped slightly as technology shares like Nvidia, which recently reported earnings, faced declines.",Invezz,Positive,GOOG|GOOGL|NVDA|SNOW,,https://invezz.com/news/2024/11/21/dow-and-sp-500-rise-nasdaq-dips-as-alphabet-nvidia-fall-and-snowflake-jumps-30/?utm_source=snapi
2024-11-21,Nvidia Analysts Grow More Bullish on Chipmaker's Stock After Strong Earnings,"After Nvidia (NVDA) reported record quarterly revenue driven by gains in its data center sales and raised expectations for its Blackwell artificial intelligence (AI) chips, several analysts boosted their price targets for the chipmaker's stock.",Investopedia,Positive,NVDA,earnings,https://www.investopedia.com/nvidia-analysts-grow-more-bullish-on-chipmaker-stock-after-strong-earnings-8749284
2024-11-21,"Nvidia's quarterly report will be 'drop the mic' moment, says Wedbush's Dan Ives","Dan Ives, Wedbush Securities global head of technology research, joins CNBC's 'Squawk on the Street' to discuss expectations for Nvidia's earnings, how competitors stand, and more.",CNBC Television,Positive,NVDA,earnings,https://www.youtube.com/watch?v=znaFrMvEHks
2024-11-21,"NVDA Bullish on Blackwell, Gross Margins Spark Concern",Steven Dickens believes Nvidia (NVDA) demonstrated its gargantuan market pull with its notable earnings beat. He cites several tailwinds that he expects will thrust the company further ahead in the A.I.,Schwab Network,Positive,NVDA,,https://www.youtube.com/watch?v=ocuyfPEzGzw
2024-11-21,Making Sense Of Nvidia's $3.6 Trillion Market Cap,"Nvidia Corporation's stock has surged 242% due to exceeding growth and profitability expectations. To justify its $3.6 trillion valuation, Nvidia needs a revenue CAGR above 30% p.a. over the next eight years, maintaining current margins and cash flow conversion. When considering the market growth rates of NVDA's underlying business segments, the company currently seems fairly valued.",Seeking Alpha,Positive,NVDA,paylimitwall,https://seekingalpha.com/article/4739372-making-sense-of-nvidia-3-6-trillion-market-cap
2024-11-21,"Nvidia Analysts See Stock 'Best Positioned In AI,' Not Worried About Guidance: 'All Systems Go For Blackwell Ramp'",NVIDIA Corporation NVDA analysts highlight the company's strong beat in the third quarter and guidance in the fourth quarter that may leave investors less confident in the short term.,Benzinga,Positive,NVDA,paywall,https://www.benzinga.com/analyst-ratings/analyst-color/24/11/42119226/nvidia-analysts-see-stock-best-positioned-in-ai-not-worried-about-guidance-all-syst?utm_source=snapi
2024-11-21,Morgan Stanley's Joseph Moore: All indications point to a strong ramp for Nvidia's Blackwell chips,"Joseph Moore, Morgan Stanley Nvidia analyst, joins CNBC's 'Money Movers' to discuss outlooks on Nvidia following the company's quarterly report.",CNBC Television,Positive,NVDA,,https://www.youtube.com/watch?v=mxRjdPwG9Fc
2024-11-21,"Strategist talks Nvidia, Walmart, and Costco","Nvidia's (NVDA) third quarter earnings beat seemed to leave investors unenthusiastic, raising questions about the sustainability of the artificial intelligence (AI) trade. Ahead of the new year, Marketgauge.com chief strategist Michele Schneider joins Morning Brief Hosts Seana Smith and Brad Smith to discuss how to position your portfolio in 2025, with a focus on the consumer sector.",Yahoo Finance,Neutral,COST|NVDA|WMT,,https://www.youtube.com/watch?v=85xPNRaG18E
2024-11-21,How Options Traders Played Nvidia's Earnings Event,"Nvidia Corp (NASDAQ:NVDA) reported quarterly results, and it's one of the b iggest drivers of price action on Wall Street today.",Schaeffers Research,Neutral,NVDA,earnings,https://www.schaeffersresearch.com/content/options/2024/11/21/how-options-traders-played-nvidias-earnings-event
2024-11-21,The 2 reasons why Nvidia will keep outperforming: Analyst,"Nvidia (NVDA) posted a beat in its fiscal third quarter results Wednesday afternoon, with revenue growing 94% year-over-year. However, that was not enough to increase the stock price.",Yahoo Finance,Positive,NVDA,,https://www.youtube.com/watch?v=8YNeL5gPmm0
2024-11-21,Nvidia's Q3 Report Green-Lights Year-End Rally,"Nvidia Corporation's stock is experiencing transitory volatility despite stellar earnings, but it is likely to recover and potentially reach $180-200 by next earnings. The AI chip market is poised for explosive growth, with Nvidia dominating the enterprise/data center AI chip market and offering unparalleled potential. Nvidia's Q3 earnings beat expectations with significant revenue growth, and its guidance suggests continued strong performance, making it a solid buy-and-hold stock.",Seeking Alpha,Positive,NVDA,earnings|paylimitwall,https://seekingalpha.com/article/4739364-nvidia-q3-report-green-lights-year-end-rally
2024-11-21,Nvidia: Grossly Undervalued,"Nvidia Corporation's Q3 earnings exceeded expectations, driven by strong Data Center growth. Free cash flow grew 138% Y/Y, outpacing revenue growth, signaling Nvidia's scalability and strong financial health. Nvidia's Q4 revenue guidance is robust, with Blackwell GPU shipments expected to further accelerate growth next year.",Seeking Alpha,Positive,NVDA,paylimitwall,https://seekingalpha.com/article/4739361-nvidia-grossly-undervalued
2024-11-21,Nvidia's disappointing revenue forecast,Nvidia's disappointing revenue forecast.,Bloomberg Markets and Finance,Negative,NVDA,earnings,https://www.youtube.com/watch?v=9SZHfa-p5qA
2024-11-21,"Opinion: Nvidia Had Great Earnings, and These Are Key Points AI Investors Should Know",Nvidia continues to see strong demand for its upcoming Blackwell AI solution.,The Motley Fool,Neutral,NVDA,earnings|podcast,https://www.fool.com/investing/2024/11/21/opinion-nvidia-had-great-earnings-and-these-are-ke/
2024-11-21,Nvidia Guidance Called Conservative As Blackwell AI Chip Production Ramps,Nvidia stock wavered Thursday as investors considered quibbles with the AI chipmaker's beat-and-raise earnings report. The post Nvidia Guidance Called Conservative As Blackwell AI Chip Production Ramps appeared first on Investor's Business Daily.,Investors Business Daily,Positive,NVDA,,https://www.investors.com/news/technology/nvidia-stock-nvda-wall-street-reactions-q3-earnings/
2024-11-21,Why Nvidia's stock price dipped despite beating earnings expectations,"NVIDIA shares climbed close to 5% at the open Thursday, turning higher after previously trading lower in premarket deals. The U.S. chipmaker reported results that beat on both the top and bottom lines, with sales climbing 94% year-on-year to $35.08 billion.",CNBC International TV,Neutral,NVDA,earnings,https://www.youtube.com/watch?v=T8wTfUfWiWI
2024-11-21,Nvidia Stock Briefly Rises To All-Time High In Rollercoaster Post-Earnings Trading,"Nvidia stock touched its highest price ever Thursday morning in a mixed investor reaction to the artificial intelligence behemoth's earnings report released Wednesday afternoon, as the world's largest company flirts with becoming the first firm to ever score a $4 trillion valuation.",Forbes,Positive,NVDA,earnings|paylimitwall,https://www.forbes.com/sites/dereksaul/2024/11/21/nvidia-stock-briefly-rises-to-all-time-high-in-rollercoaster-post-earnings-trading/
2024-11-21,Analysts raise Nvidia stock price target after earnings,"Since the beginning of the rapid rise of AI, Nvidia's (NASDAQ: NVDA) quarterly earnings reports have been some of the most highly-anticipated days in the year. Nvidia stock has been one of the best performers of the S&P 500 thus far — but the company's high valuation remains a pivotal concern.",Finbold,Neutral,NVDA,earnings,https://finbold.com/analysts-raise-nvidia-stock-price-target-after-earnings/?utm_source=snapi
2024-11-21,Should You Buy the Dip in NVIDIA ETFs on Q3 Earnings Beat?,"NVIDIA NVDA reported robust third-quarter fiscal 2025 results, topping earnings and revenue estimates. Revenues doubled year over year amid relentless demand for its artificial intelligence chips.",Zacks Investment Research,Positive,NVDA,earnings,https://www.zacks.com/stock/news/2373448/should-you-buy-the-dip-in-nvidia-etfs-on-q3-earnings-beat?cid=CS-STOCKNEWSAPI-FT-etf_news_and_commentary-2373448
2024-11-21,"'Constraints' on Nvidia mean 'more is coming later,' says Melius Research's Ben Reitzes","Ben Reitzes, Melius Research head of technology research, joins CNBC's 'Squawk on the Street' to discuss expectations for Nvidia, reactions to the most recent earnings report, and more.",CNBC Television,Positive,NVDA,,https://www.youtube.com/watch?v=s08Yt1MZVoc
2024-11-21,"Nvidia: Blackwell Ramp Hit Gross Margin, Expecting Low 70s","Nvidia Corporation's stock pulled back after a strong Q3 FY2025 earnings report, driven by high expectations amid a lofty valuation, with a narrowing 3Q EPS beat. Blackwell is now in full production, boosting revenue consensus for the coming quarters, as management anticipates increased supply and signals exceeding the “several billion dollars” revenue outlook. The company prioritizes strong Blackwell demand at the cost of gross margin contraction, guiding a “low 70s” outlook in the near term and anticipating continued margin decline until 2H FY2026.",Seeking Alpha,Negative,NVDA,paylimitwall,https://seekingalpha.com/article/4739330-nvidia-blackwell-ramp-hit-gross-margin-expecting-low-70s
2024-11-21,Wall Street Bulls Look Optimistic About Nvidia (NVDA): Should You Buy?,"Investors often turn to recommendations made by Wall Street analysts before making a Buy, Sell, or Hold decision about a stock. While media reports about rating changes by these brokerage-firm employed (or sell-side) analysts often affect a stock's price, do they really matter?",Zacks Investment Research,Positive,NVDA,,https://www.zacks.com/stock/news/2373314/wall-street-bulls-look-optimistic-about-nvidia-nvda-should-you-buy?cid=CS-STOCKNEWSAPI-FT-fundamental_analysis|average_broker_rating-2373314
2024-11-21,Why Is Nvidia Stock Down After Reporting Parabolic Growth?,Nvidia's growth story is far from over and Blackwell seems to be the next growth driver.,The Motley Fool,Neutral,NVDA,podcast,https://www.fool.com/investing/2024/11/21/why-is-nvidia-stock-down-after-reporting-parabolic/
2024-11-21,NVIDIA's Q3 Earnings Beat: Can Strong Q4 Guidance Lift Shares Up?,NVDA's third-quarter fiscal 2025 results reflect the benefits of strength across all of its end markets.,Zacks Investment Research,Positive,NVDA,earnings,https://www.zacks.com/stock/news/2373329/nvidia-s-q3-earnings-beat-can-strong-q4-guidance-lift-shares-up?cid=CS-STOCKNEWSAPI-FT-analyst_blog|earnings_article-2373329
2024-11-21,Dow Jumps Over 100 Points; Nvidia Posts Upbeat Earnings,"U.S. stocks traded higher this morning, with the Dow Jones index gaining by more than 100 points on Thursday.",Benzinga,Positive,NVDA,earnings|paywall|pricemovement,https://www.benzinga.com/24/11/42115220/dow-jumps-over-100-points-nvidia-posts-upbeat-earnings?utm_source=snapi
2024-11-21,"After Nvidia's earnings, this is the most impressive feat",Nvidia's stock is largely holding its own despite a lack of oomph in the guidance. That reflects how well investors understand the company's narrative and cadence.,Market Watch,Neutral,NVDA,earnings|paylimitwall,https://www.marketwatch.com/story/after-nvidias-earnings-this-is-the-most-impressive-feat-ec2a9324
2024-11-21,"Nvidia Beat Q3 Estimates But Still Falls, Momentum Is Dying","Nvidia Corporation's Q3 2025 results beat estimates with 94% YoY revenue growth and 103% EPS growth, but the stock fell 1.21% in after-hours trading, suggesting that investors already priced in a beat. Despite strong performance, Nvidia's current valuation prices in significant future growth, making the stock less attractive for long-term investors at current levels. Hyperscaler demand remains robust, with major partners like Oracle, Microsoft, and AWS driving Data Center revenue, despite concerns over overheating GPUs.",Seeking Alpha,Positive,NVDA,earnings|paylimitwall,https://seekingalpha.com/article/4739318-nvidia-beat-q3-estimates-but-still-falls-momentum-is-dying
2024-11-21,"Markets Climb ""On Back of NVDA,"" Watch Commodity Trends",Nvidia (NVDA) once again showed its strength by giving the markets a pop following its earnings beat. Kevin Green highlights how the SPX is breaking out of consolidation thanks to the A.I.,Schwab Network,Positive,NVDA,,https://www.youtube.com/watch?v=U70o3HeIGRg
2024-11-21,Nvidia Stock Price Levels to Watch After Earnings Top Expectations,Nvidia (NVDA) shares moved higher in premarket trading Thursday after the AI chipmaker released quarterly results and an outlook that surpassed analysts' expectations.,Investopedia,Positive,NVDA,earnings,https://www.investopedia.com/nvidia-stock-price-levels-to-watch-after-earnings-top-expectations-8749191
2024-11-21,"Commentary on Nvidia's earnings call saved stock from falling further, says Dan Niles","Dan Niles, Niles Investment Management founder and portfolio manager, joins 'Squawk Box' to discuss what to make of Nvidia's quarterly earnings results, the idea that Nvidia missed on their earnings results, and much more.",CNBC Television,Neutral,NVDA,earnings,https://www.youtube.com/watch?v=fi6Gfje1-nw
2024-11-21,Nvidia Just Delivered a Beat-and-Raise Quarter. There's 1 Red Flag Investors Shouldn't Ignore.,The chipmaker continued to benefit from robust demand for artificial intelligence (AI). Will it last?,The Motley Fool,Neutral,NVDA,,https://www.fool.com/investing/2024/11/21/nvidia-just-delivered-a-beat-and-raise-quarter-the/
2024-11-21,Nvidia stock dips on earnings despite eye-popping 94% revenue growth as AI demand holds strong,"In what's become a must-watch event for Wall Street types: Nvidia released its latest earnings report after Wednesday's market close, showing numbers that beat analysts' estimates.",Fast Company,Neutral,NVDA,earnings|paylimitwall,https://www.fastcompany.com/91232944/nvidia-nvda-stock-price-earnings-report-record-high-revenue-growth-ai-demand-strong
2024-11-21,"Nvidia's quarter was a 'spike the ball in the endzone' performance, says Constellation's Ray Wang","Ray Wang, Constellation Research founder, chairman and principal analyst, joins 'Squawk Box' to discuss the decline in Nvidia's stock price post-earnings, Wang's investment thesis on the stock, and much more.",CNBC Television,Positive,NVDA,,https://www.youtube.com/watch?v=edFXqAfL_Wk
2024-11-21,Live Updates: Can NVIDIA (NVDA) Stock Surge PastHe $150 Today After Earnings?,Here's a collection of price target revisions today following NVIDIA's earnings.,24/7 Wall Street,Positive,NVDA,,https://247wallst.com/investing/2024/11/21/live-updates-can-nvidia-nvda-stock-surge-pasthe-150-today-after-earnings/?utm_source=snapi
2024-11-21,Live Updates: Can NVIDIA (NVDA) Stock Surge Past $150 Today After Earnings?,The Nasdaq opened up higher but is now down about .40% at 9:43 a.m. ET. NVIDIA is also seeing gains see-saw.,24/7 Wall Street,Positive,NVDA,,https://247wallst.com/technology-3/2024/11/21/live-updates-can-nvidia-nvda-stock-surge-pasthe-150-today-after-earnings/?utm_source=snapi
2024-11-21,S&P 500: Tech Stocks Rally as Nvidia Recovers and Bitcoin Hits $98K,Nvidia's rebound and Bitcoin's record surge to $98K drive Nasdaq 100 and S&P 500 futures higher. Read the latest on tech stocks and market sentiment today.,FXEmpire,Positive,IVV|NVDA|SPLG|SPXL|SPY|SSO|UPRO|VOO,,https://www.fxempire.com/forecasts/article/sp-500-tech-stocks-rally-as-nvidia-recovers-and-bitcoin-hits-98k-1477888
2024-11-21,Market expert warns Nvidia stock will plummet to $114,"Nvidia's (NASDAQ: NVDA) latest quarterly report caused a significant stock market splash. Investors were, at least in the beginning, far from impressed despite the company beating earnings and revenue forecasts.",Finbold,Negative,NVDA,,https://finbold.com/market-expert-warns-nvidia-stock-will-plummet-to-114/?utm_source=snapi
2024-11-21,Nvidia's Blackwell era will test the world's most valuable company in a highwire act,"Nvidia has a lot riding on Blackwell, its new flagship AI chip. Investors had a tepid response to earnings despite reporting $35.1 billion in third-quarter revenue.",Business Insider,Neutral,NVDA,paywall,https://www.businessinsider.com/nvidia-blackwell-ai-chip-sales-earnings-jensen-huang-2024-11
2024-11-21,I bought NVIDIA's stock and now it's half of my portfolio's value – should I sell some to diversify?,Nvidia (NASDAQ:NVDA) stock's unprecedented multi-year surge has minted a lot of big winners.,24/7 Wall Street,Positive,NVDA,,https://247wallst.com/personal-finance/2024/11/21/i-bought-nvidias-stock-and-now-its-half-of-my-portfolios-value-should-i-sell-some-to-diversify/?utm_source=snapi
2024-11-21,"Another jumbo revenue beat later, the Nvidia dilemma is clearer than ever",Nvidia Corp's unrivalled explosion in revenue growth has painted the chipmaking giant into more than one corner. It has become a given that the artificial intelligence darling will deliver supersized revenue beats in every single reporting period.,Proactive Investors,Neutral,NVDA,earnings,https://www.proactiveinvestors.co.uk/companies/news/1061205?SNAPI
2024-11-21,"""In the Early Innings"" for NVDA Chip Demand","Ali Mogharabi calls Nvidia's earnings “very impressive,” pointing to its strong revenue growth and guidance. Demand remains steady over every category, and he talks about client stickiness once a company has the suite of Nvidia products installed.",Schwab Network,Positive,NVDA,,https://www.youtube.com/watch?v=HnPryNyatkc
2024-11-21,Forget Guidance Woes: Buy Semiconductor ETFs on NVDA's Dip,Forget NVIDIA's less lofty sales guidance. Bet on NVIDIA and its related ETFs to tap the ongoing AI boom.,Zacks Investment Research,Neutral,NVDA,,https://www.zacks.com/stock/news/2373158/forget-guidance-woes-buy-semiconductor-etfs-on-nvda-s-dip?cid=CS-STOCKNEWSAPI-FT-etf_news_and_commentary-2373158
2024-11-21,"Nvidia Stock Pops 2% Despite Slower Growth View, Margin Drop","On Wednesday, Nvidia — the designer of 90% of chips used for artificial intelligence — reported a surge in revenue for the October-ending quarter, according to the New York Times.",Forbes,Positive,NVDA,paylimitwall,https://www.forbes.com/sites/petercohan/2024/11/21/nvidia-stock-pops-2-despite-slower-growth-view-margin-drop/
2024-11-21,"Can NVIDIA Stock Hit $1,000 Again After its Recent Stock Split?",Nvidia (NASDAQ:NVDA) just reported some incredibly strong third-quarter numbers that saw sales double.,24/7 Wall Street,Positive,NVDA,,https://247wallst.com/investing/2024/11/21/can-nvidia-stock-hit-1000-again-after-its-recent-stock-split/?utm_source=snapi
2024-11-21,NVIDIA Growth Slows: So What? The Uptrend Will Continue,"NVIDIA's NASDAQ: NVDA growth is slowing, and margins are expected to compress, but so what? The company's business has grown nearly 800% in the last four years and continues to grow.",MarketBeat,Positive,NVDA,,https://www.marketbeat.com/stock-ideas/nvidia-growth-slows-so-what-the-uptrend-will-continue/?utm_source=snapi
2024-11-21,"Nvidia Q3: Results Are Up But Stock Isn't, Reiterating Hold","NVIDIA 3QFY25 and commentary on the call led us to maintain our hold. Our point of concern is NVIDIA's near-term gross margin issue, with management reporting a sequential decline and guiding for one in Q4 with GM outlook of 73% to 73.5%. NVIDIA's valuation remains priced for perfection, which puts the stock at higher risk with the gross margin issue.",Seeking Alpha,Negative,NVDA,earnings|paylimitwall,https://seekingalpha.com/article/4739178-nvidia-q3-results-are-up-stock-is-not-reiterating-hold
2024-11-21,"Cakmak: Data centers, gaming, and strong margins keep NVIDIA attractive","James Cakmak, CIO at Clockwise Capital, discusses trimming semiconductor holdings, including NVIDIA, due to sky-high expectations and shifting to areas with better relative value.",CNBC Television,Positive,NVDA,,https://www.youtube.com/watch?v=BXGwrJ1Hb6w
2024-11-21,Nvidia's own success is standing in the way of its stock price gains,Nvidia Corp (NASDAQ: NVDA) dipped in pre-market trading despite handily beating Wall Street estimates for its third financial quarter and issuing strong guidance that also topped expectations. This begs the question: why isn't this positive performance reflected in the company's share price?,Invezz,Positive,NVDA,,https://invezz.com/news/2024/11/21/nvidias-own-success-is-standing-in-the-way-of-its-stock-price-gains/?utm_source=snapi
2024-11-21,"Nvidia's earnings are still exceptionally strong, says Bank of America's Vivek Arya","Vivek Arya, Bank of America Securities senior semiconductors analyst, joins 'Squawk Box' to discuss Arya's thoughts on Nvidia's earnings results, where the disappointment is in the stock, and the analyst's thoughts on the company's Blackwell chip.",CNBC Television,Positive,NVDA,earnings,https://www.youtube.com/watch?v=VnRldxwp9WA
2024-11-21,Nvidia Earnings: This Stock Is In Danger Of Hitting A Wall (Rating Downgrade),"Nvidia reported Q3 earnings after the close Wednesday to unimpressed investors. Revenue growth deceleration and gross margin declines remain concerns. NVDA still has a bright long-term future, but the short- and medium-term picture has become murky.",Seeking Alpha,Negative,NVDA,earnings|paylimitwall,https://seekingalpha.com/article/4739233-nvidia-q3-earnings-stock-in-danger-of-hitting-wall
2024-11-21,"US Futures Head Lower As Nvidia Earnings Fail To Impress Investors: Expert Says Market Weakness Is 'Perfectly Normal,' But Late November Rally Is Still Possible",U.S. stocks could open on a negative note on Thursday after AI bellwether Nvidia Corp.'s NVDA guidance fell short of some expectations. Futures of all three major indices were down as investors processed the AI giant's earnings.,Benzinga,Negative,NVDA,earnings|paywall|futures,https://www.benzinga.com/24/11/42107863/us-futures-head-lower-as-nvidia-reports-slowdown-in-quarterly-revenue-growth-expert-says-market-weakness-is-perfe?utm_source=snapi
2024-11-21,AMERICAS Nvidia sees past triple-digit growth,A look at the day ahead in U.S. and global markets from Mike Dolan,Reuters,Neutral,NVDA,,https://www.reuters.com/markets/us/global-markets-view-usa-2024-11-21/
2024-11-21,"Nasdaq, Wall Street to drop as Nvidia slides after earnings","Wall Street faced a negative start on Thursday in the wake of Nvidia Corp's earnings, which saw the chip-making giant slip almost 3% in pre-market trading. Futures had the Nasdaq down 0.4% ahead of the opening bell, while the S&P 500 and Dow Jones were seen 0.3% and 0.2% lower respectively.",Proactive Investors,Negative,NVDA,earnings,https://www.proactiveinvestors.com/companies/news/1061194?SNAPI
2024-11-21,Nvidia's Coming Year Will Be a Turbulent One,"The AI titan will maintain its strong lead, but complicated product rollouts, sky-high expectations and the China threat add complications to growth potential.",WSJ,Negative,NVDA,paywall,https://www.wsj.com/articles/nvidias-coming-year-will-be-a-turbulent-one-3bc9aa54?mod=rss_markets_main
2024-11-21,Super Micro Stock Falls Despite Nvidia Shout-Out. Why It's Still Bumpy.,"The stock surged Tuesday, just after it said it had hired a new auditor and that it had a plan to submit its late earnings results that would allow it to remain listed on the Nasdaq.",Barrons,Neutral,NVDA|SMCI,paywall,https://www.barrons.com/articles/super-micro-stock-nvidia-nasdaq-2f24279c
2024-11-21,Billionaire Steven Cohen Increased Point72's Stake in Nvidia by 74% and Dumped Every Share of This Dual-Industry Leader,"While Cohen was piling into Wall Street's artificial intelligence (AI) darling in the September-ended quarter, he was showing every share Point72 owned in another ""Magnificent Seven"" stock to the door.",The Motley Fool,Positive,NVDA,,https://www.fool.com/investing/2024/11/21/billionaire-steven-cohen-increase-stake-nvidia-74/
2024-11-21,Nvidia shares slump 3% in premarket as quarterly revenue growth slows,"Nvidia shares slumped in U.S. premarket trading Wednesday after the chipmaking giant reported results that beat on both the top and bottom lines. Despite nearly doubling sales year-on-year, Nvidia's third-quarter results show a slowdown from previous quarters.",CNBC,Negative,NVDA,earnings,https://www.cnbc.com/2024/11/21/nvidia-nvda-stock-slumps-despite-q3-earnings-beat.html
2024-11-21,"Nvidia to build AI school in Indonesia, country's VP says","U.S. chipmaker Nvidia plans to invest in several cities in Indonesia, including building a school focusing on artificial intelligence in Central Java province, the country's vice president said on Thursday.",Reuters,Positive,NVDA,,https://www.reuters.com/technology/artificial-intelligence/nvidia-build-ai-school-indonesia-countrys-vp-says-2024-11-21/
