date,title,text,source_name,sentiment,tickers,topics,url
2024-11-13,"SoftBank Corp. Develops 5G L1 Software, Achieving Carrier-grade High Performance and Quality vRAN on NVIDIA Grace Hopper Platform","TOKYO--(BUSINESS WIRE)--(TOKYO:9434, “SoftBank”) announced it developed 5G L1* software based on the NVIDIA AI Aerial platform, delivering the high stability and high performance essential for a carrier-grade RAN through parallel signal processing and the optimization of task initiation timing. With this newly developed L1 software, carrier-grade stability has been achieved. In addition to realizing high stability, SoftBank will develop L1 software that can achieve maximized RAN capacity and re.",Business Wire,Neutral,NVDA|SFTBF|SFTBY,PressRelease,https://www.businesswire.com/news/home/20241112373078/en/SoftBank-Corp.-Develops-5G-L1-Software-Achieving-Carrier-grade-High-Performance-and-Quality-vRAN-on-NVIDIA-Grace-Hopper-Platform/
2024-11-13,Japan Cloud Leaders Build NVIDIA AI Infrastructure to Transform Industries for the Age of AI,"SoftBank Corp., GMO Internet Group, Highreso, KDDI, Rutilea and SAKURA Internet Adopt NVIDIA Accelerated Computing, Networking and Software to Advance Robotics, Auto, Healthcare, Telecom and Public Sector in Japan SoftBank Corp., GMO Internet Group, Highreso, KDDI, Rutilea and SAKURA Internet Adopt NVIDIA Accelerated Computing, Networking and Software to Advance Robotics, Auto, Healthcare, Telecom and Public Sector in Japan",GlobeNewsWire,Neutral,NVDA,PressRelease,https://www.globenewswire.com/news-release/2024/11/13/2979887/0/en/Japan-Cloud-Leaders-Build-NVIDIA-AI-Infrastructure-to-Transform-Industries-for-the-Age-of-AI.html
2024-11-12,Analysts Are Bullish on Nvidia Stock Ahead of Earnings Next Week,Nvidia (NVDA) shares rose Tuesday after analysts at Mizuho raised their price target for the company's stock ahead of its third-quarter results due next week.,Investopedia,Positive,NVDA,,https://www.investopedia.com/analysts-bullish-on-nvidia-stock-ahead-of-earnings-next-week-8743940
2024-11-12,Buy Profitable S&P 500 Stocks as the Index Tops 6000: NVIDIA & 2 More,"NVIDIA, Insulet and Howmet Aerospace have been selected as the top picks with a high net income ratio.",Zacks Investment Research,Positive,HWM|NVDA|PODD,,https://www.zacks.com/stock/news/2369189/buy-profitable-s-p-500-stocks-as-the-index-tops-6000-nvidia-2-more?cid=CS-STOCKNEWSAPI-FT-analyst_blog|rw-2369189
2024-11-12,"SERV CEO on Acquiring Vebu, NVDA Partnership & Autonomous Industry","Ali Kashani, CEO of Serve Robotics (SERV), discusses the company's direction after acquiring Vebu. He hopes to expand the company's footprint in autonomous robot deliveries.",Schwab Network,Positive,NVDA|SERV,CEO|manda,https://www.youtube.com/watch?v=BbrLNd1h8C8
2024-11-12,"NVDA's Case to Grow 50%, TSLA ""Hard to Buy,"" TEAM's Momentum","When looking at today's sluggish trading day, Eddy Gifford says the market ""has to breathe once in a while."" Turning to Big Tech, he expects Nvidia (NVDA) to have substantial upside room to run with its stock price.",Schwab Network,Positive,NVDA|TSLA|TEAM,,https://www.youtube.com/watch?v=JaSciXxxJPo
2024-11-12,Nvidia: Q3 Earnings Could Ignite $200 Rally,"Nvidia Corporation's Q3 FY25 revenue forecast is $32.5 billion, reflecting an 81.8% YoY growth driven by Hopper and Blackwell GPUs. Blackwell GPU production accelerates in Q4 2024, with units priced at $30K–$40K and demand outstripping supply. Nvidia's operating margin has grown to 68%, highlighting profitability from strong data center demand and high-margin products.",Seeking Alpha,Positive,NVDA,earnings|paylimitwall,https://seekingalpha.com/article/4736453-nvidia-q3-earnings-could-ignite-200-rally
2024-11-12,Google And Nvidia Share Three Traits. One Is A Cautionary Tale.,"As Nvidia notches a record high and Google stock teases a breakout, both AI giants also share this note of caution. The post Google And Nvidia Share Three Traits.",Investors Business Daily,Positive,GOOG|GOOGL|NVDA,paywall,https://www.investors.com/research/breakout-stocks-technical-analysis/google-stock-alphabet-nvidia-breakout-stocks-index/
2024-11-12,AWS is negotiating a huge deal to supply IBM with Nvidia GPUs via the cloud,"AWS is negotiating a potential $475 million AI cloud deal with IBM. IBM already uses AWS services for AI, including training models on EC2 servers with Nvidia chips.",Business Insider,Positive,IBM|NVDA|AMZN,paywall,https://www.businessinsider.com/aws-negotiating-huge-cloud-deal-supply-ibm-with-nvidia-gpus-2024-11
2024-11-12,"Nvidia may break its beat-and-raise streak, but there's good news for investors",Nvidia's outlook for the January quarter may not wow Wall Street when the company posts earnings next week. But Mizuho analysts see bright prospects for later next year.,Market Watch,Neutral,NVDA,paylimitwall,https://www.marketwatch.com/story/nvidia-may-break-its-beat-and-raise-streak-but-theres-good-news-for-investors-ffca7fcd
2024-11-12,Nvidia Stock Just Got Numerous Price Upgrades as Analysts Anticipate Strong Demand for Blackwell Chips,"Nvidia stock recently got price target hikes from UBS, Piper Sandler, and Morgan Stanley.",The Motley Fool,Positive,NVDA,podcast,https://www.fool.com/investing/2024/11/12/nvidia-stock-just-got-numerous-price-upgrades-as-a/
2024-11-12,"Amazon offers free computing power to AI researchers, aiming to challenge Nvidia","Amazon.com's cloud computing unit on Tuesday said it will offer free computing power to researchers who want to use its custom artificial intelligence chips, aiming to challenge Nvidia's popularity among those researchers.",Reuters,Positive,AMZN|NVDA,,https://www.reuters.com/technology/artificial-intelligence/amazon-offers-free-computing-power-ai-researchers-aiming-challenge-nvidia-2024-11-12/
2024-11-12,GFT Taps NVIDIA AI Enterprise and NVIDIA Omniverse Platforms to Deliver AI Solutions for Financial Services and Manufacturing,"NEW YORK & MONTREAL--(BUSINESS WIRE)--GFT Technologies is collaborating with NVIDIA to bring advanced AI solutions to the financial services and manufacturing sectors. The collaboration will combine GFT's deep expertise in digitalising global banks, financial institutions and manufacturers with NVIDIA's AI software tools and accelerated computing platform for generative AI to drive a new level of innovation and efficiency in both industries. GFT will use the NVIDIA AI Enterprise software platfo.",Business Wire,Neutral,NVDA,PressRelease,https://www.businesswire.com/news/home/20241112418164/en/GFT-Taps-NVIDIA-AI-Enterprise-and-NVIDIA-Omniverse-Platforms-to-Deliver-AI-Solutions-for-Financial-Services-and-Manufacturing/
2024-11-12,Will Nvidia Cut Ties With Super Micro Computer?,Supermicro is under scrutiny after failing to report financial statements on time.,The Motley Fool,Negative,NVDA|SMCI,podcast,https://www.fool.com/investing/2024/11/12/will-nvidia-cut-ties-with-super-micro-computer/
2024-11-12,Amazon Will Challenge Nvidia as a Real Threat,24/7 Wall St. Insights Amazon.com Inc. (NASDAQ: AMZN) reportedly will manufacture its own AI chips.,24/7 Wall Street,Negative,AMZN|NVDA,,https://247wallst.com/technology-3/2024/11/12/amazon-will-challenge-nvidia-as-a-real-threat/?utm_source=snapi
2024-11-12,"The S&P 500 Can Gain 20% and Hit 7,400: Here's How","The S&P 500 NYSEARCA: SPY is in a strong uptrend that is gaining momentum following the 2024 election results. The robust technical outlook suggests that the market can increase by another 20% to reach 7,400.",MarketBeat,Positive,AMZN|META|NVDA|SPY,,https://www.marketbeat.com/originals/the-s-and-p-500-can-gain-20-and-hit-7-400-heres-how/?utm_source=snapi
2024-11-12,"The Zacks Analyst Blog NVIDIA, Amazon, Visa and Salesforce","NVIDIA, Amazon, Visa and Salesforce are included in this Analyst Blog.",Zacks Investment Research,Neutral,AMZN|CRM|NVDA|V,,https://www.zacks.com/stock/news/2368520/the-zacks-analyst-blog-nvidia-amazon-visa-and-salesforce?cid=CS-STOCKNEWSAPI-FT-press_releases-2368520
2024-11-12,Nvidia Stock Stalls. There Is a Concern Ahead of Its Earnings Report.,The company has regularly impressed the market with earnings ahead of expectations but it might struggle to do so this time.,Barrons,Negative,NVDA,paywall,https://www.barrons.com/articles/nvidia-stock-price-buy-sell-217e9705
2024-11-12,Billionaire David Tepper Sold 93% of Appaloosa's Stake in Nvidia and Is Piling Into One of China's Most Prominent Growth Stocks,Tepper is dumping Wall Street's hottest artificial intelligence (AI) stock in favor of a cash-rich growth stock in China.,The Motley Fool,Positive,JD|NVDA,,https://www.fool.com/investing/2024/11/12/billionaire-david-tepper-sold-93-stake-in-nvidia/
2024-11-12,Nvidia Stock vs. Amazon Stock: Billionaire Ken Griffin Buys One and Sells the Other,Star hedge fund manager Ken Griffin has been selling Nvidia and buying Amazon.,The Motley Fool,Neutral,AMZN|NVDA,,https://www.fool.com/investing/2024/11/12/nvidia-stock-amazon-stock-ken-griffin-buy-sell/
2024-11-12,2 Reasons to Buy Nvidia Before Nov. 20 and 1 Reason to Wait,This top AI stock has soared nearly 200% this year.,The Motley Fool,Positive,NVDA,,https://www.fool.com/investing/2024/11/12/2-reasons-to-buy-nvidia-before-nov-20-and-1-reason/
2024-11-11,Should You Buy Nvidia Stock Before Nov. 20? Here's What History Suggests,Nvidia will report third quarter earnings on Nov. 20.,The Motley Fool,Neutral,NVDA,,https://www.fool.com/investing/2024/11/11/should-you-buy-nvidia-stock-before-nov-20-heres-wh/
2024-11-11,"NVDA's Continuing ""Reinvention,"" META's Outlook","Craig Warnimont says Nvidia (NVDA) has a bigger history than many people realize due to its constant ""reinvention"" of itself. It's part of the reason why he still expects to see explosive growth in the company's future.",Schwab Network,Positive,META|NVDA,,https://www.youtube.com/watch?v=-WNEID3V7CY
2024-11-11,"4 Stocks to Gain as Dow Roars Past 44,000 for the First Time","Stocks like NVDA, AMZN, V and CRM will benefit from the Dow's ongoing rally.",Zacks Investment Research,Positive,AMZN|CRM|NVDA|V,,https://www.zacks.com/stock/news/2368426/4-stocks-to-gain-as-dow-roars-past-44-000-for-the-first-time?cid=CS-STOCKNEWSAPI-FT-analyst_blog|investment_ideas-2368426
2024-11-11,Wall Street Bulls Ramp Up NVDA Price Targets,"Several analysts increased their price targets on Nvidia (NVDA) even as the stock trades down. Caroline Woods dives into the commentary behind the notes to learn why they ""don't want to bet against"" the company.",Schwab Network,Positive,NVDA,,https://www.youtube.com/watch?v=hpOKKrcApx0
2024-11-11,Wall Street Lunch: Nvidia On Top,"Nvidia is Piper Sandler's top large-cap pick due to its strong position in the growing AI accelerator market, with a $175 price target. Block is expected to gain from the shift to electronic payments, driven by its innovative segments, Square and Cash App.",Seeking Alpha,Positive,NVDA,podcast|paylimitwall,https://seekingalpha.com/article/4736104-wall-street-lunch-nvidia-on-top-yet-again
2024-11-11,Nvidia Q3 Preview: The Going Is Still Good For Now,"Nvidia Corporation's AI-driven growth continues, but a cyclical decline looms when the first infrastructure build-out peaks. Q3 guidance: $32.5B revenue, 75% gross margin. My EPS estimate is $0.78 (above the $0.74 consensus). My model estimates $235B in revenue and $152.75B in EBITDA for Fiscal 2028.",Seeking Alpha,Negative,NVDA,paylimitwall,https://seekingalpha.com/article/4736087-nvidia-q3-preview-going-is-still-good-for-now
2024-11-11,"Nvidia's breakneck growth hasn't topped out yet, says UBS","There is scope for the world's most valuable company to become even more valuable, according to the equities experts at UBS. Nvidia Corp, whose bleeding-edge microchips have powered the artificial intelligence revolution, could post “strong enough results and guidance to keep the stock moving higher”, the bank said in a research note.",Proactive Investors,Positive,NVDA,,https://www.proactiveinvestors.com/companies/news/1060337?SNAPI
2024-11-11,Nvidia CEO confirms Supercomputing powerhouse for internal testing,"Between its market share, market capitalization, and prevalence in media and online discussions, Nvidia (NASDAQ: NVDA) is undoubtedly the leading company in the semiconductor industry.",Finbold,Positive,NVDA,CEO,https://finbold.com/nvidia-ceo-confirms-supercomputing-powerhouse-for-internal-testing/?utm_source=snapi
2024-11-11,NVDA's Valuation Paradox & TSLA's Future,"2025 will be a ""story of valuations"" for Nvidia (NVDA), according to Adam Coons. He believes more pressure on the stock through earnings and uncertain relations with China leaves Nvidia's future shrouded.",Schwab Network,Negative,NVDA|TSLA,,https://www.youtube.com/watch?v=WlvHaU69EhI
2024-11-11,Nvidia stock short ratio hits two-week high as NVDA closes in on $150,"Nvidia (NASDAQ: NVDA) has been one of the most remarkable stock market performers in 2024 and has, in many ways, become emblematic of the ongoing artificial intelligence (AI) boom.",Finbold,Positive,NVDA,,https://finbold.com/nvidia-stock-short-ratio-hits-two-week-high-as-nvda-closes-in-on-150/?utm_source=snapi
2024-11-11,Why Nvidia's Dow Jones Inclusion Is Not Bullish,"Stocks added to the Dow Jones Industrial Average, or DJIA, often underperform, while those deleted frequently outperform, suggesting Nvidia Corporation's inclusion may not be bullish. Historical DJIA changes show cyclical stocks are often added at highs and deleted at lows, cautioning against over-optimism for Nvidia. The S&P 500 has outperformed the DJIA since 2010, highlighting the limitations of the DJIA's 30-stock composition in reflecting the broader market.",Seeking Alpha,Positive,NVDA,paylimitwall,https://seekingalpha.com/article/4736039-why-nvidia-dow-jones-inclusion-is-not-bullish
2024-11-11,Should You Forget Palantir and Buy These 2 AI Stocks Instead?,"Nvidia and TSMC look more reasonably valued, relative to their growth potential.",The Motley Fool,Positive,NVDA|TSM,,https://www.fool.com/investing/2024/11/11/should-you-forget-palantir-and-buy-these-ai-stocks/
2024-11-11,Nvidia (NVDA) Ahead of Earnings; Tesla (TSLA) Post-Election,It “could be time for a breather” in Nvidia (NVDA) shares says Logan Gilland. The stock hit a new all-time high last Friday.,Schwab Network,Neutral,NVDA|TSLA,,https://www.youtube.com/watch?v=1MuFJ1ZEH-E
2024-11-11,"Nvidia Stock Called 'Must-Own,' 'Once-In-A-Lifetime Opportunity'","Nvidia stock received price-target increases Monday from two Wall Street analysts who gushed about the chipmaker's opportunity in artificial intelligence. The post Nvidia Stock Called 'Must-Own,' 'Once-In-A-Lifetime Opportunity' appeared first on Investor's Business Daily.",Investors Business Daily,Positive,NVDA,,https://www.investors.com/news/technology/nvidia-stock-called-once-in-a-lifetime-opportunity/
2024-11-11,Nvidia's stock is up 200% this year. Why analysts say it still screams ‘buy.,"One analyst made Nvidia's stock his new top large-cap chip pick, while another likened Nvidia's position to Apple's in the early days of the iPhone.",Market Watch,Positive,NVDA,paylimitwall,https://www.marketwatch.com/story/nvidias-stock-is-up-200-this-year-why-analysts-say-it-still-screams-buy-5f1310e1
2024-11-11,Ubitus Unveils Next-Gen AI Innovations at NVIDIA AI Summit Japan 2024,TOKYO--(BUSINESS WIRE)-- #AI--Ubitus integrates AI with robotic Innovations at NVIDIA AI Summit Japan 2024.,Business Wire,Neutral,NVDA,PressRelease,https://www.businesswire.com/news/home/20241111755731/en/Ubitus-Unveils-Next-Gen-AI-Innovations-at-NVIDIA-AI-Summit-Japan-2024/
2024-11-11,2 Stocks Super Micro Computer Investors Can Swap Into,The artificial intelligence (AI) boom has ignited certain computer and technology sector stocks that are direct benefactors of AI deployment. It's no secret that AI chipmaker NVIDIA Co. NASDAQ: NVDA is a top benefactor of AI demand as its GPUs are the essential component of AI servers.,MarketBeat,Positive,DELL|HPE|NVDA|SMCI,,https://www.marketbeat.com/stock-ideas/2-stocks-super-micro-computer-investors-can-swap-into/?utm_source=snapi
2024-11-11,Nvidia May Not Beat Earnings This Time (Rating Downgrade),"Nvidia's Q2 FY2025 results were strong, but Q3 may not exceed forecasts significantly, leading to a potential stock price decline. It's hard to deny that there has been significant business growth in recent years, which explains Nvidia's stock price performance - this is evident in the company's EPS momentum. Despite robust demand for AI and data center products, supply chain issues and geopolitical tensions pose risks to Nvidia's short-term performance.",Seeking Alpha,Neutral,NVDA,earnings|paylimitwall,https://seekingalpha.com/article/4736020-nvidia-may-not-beat-earnings-this-time-downgrade
2024-11-11,S&P 500 Could Fall 25% to ‘Normal' Value,"24/7 Wall St. Insights If the S&P 500 resets to its “normal” level, the index will fall 25%.",24/7 Wall Street,Neutral,NVDA,,https://247wallst.com/investing/2024/11/11/sp-500-could-fall-25-to-normal-value/?utm_source=snapi
2024-11-11,What Could Drive Nvidia Down?,24/7 Wall St. Insights Expectations for Nvidia Corp.,24/7 Wall Street,Neutral,NVDA,,https://247wallst.com/technology-3/2024/11/11/what-could-drive-nvidia-stock-down/?utm_source=snapi
2024-11-11,Billionaire Ken Griffin of Citadel Is Piling Into Palantir and Broadcom and Selling Shares of Wall Street's Artificial Intelligence (AI) Darling,"While Griffin has notably added to his hedge fund's stake in hotshot artificial intelligence (AI) stocks Palantir and Broadcom, his fund slashed its position in the company that's the face of the AI revolution.",The Motley Fool,Negative,AVGO|NVDA|PLTR,,https://www.fool.com/investing/2024/11/11/billionaire-ken-griffin-pile-in-palantir-broadcom/
2024-11-11,"Nvidia Stock Has Reached New Highs. Earnings, Blackwell AI Chip Sales Are Next Test.",Nvidia's earnings report comes on Nov. 20 and the key question is around sales of its Blackwell chips.,Barrons,Positive,NVDA,earnings|paywall,https://www.barrons.com/articles/nvidia-stock-price-ai-chips-blackwell-earnings-abf492e2
2024-11-11,"2 Nasdaq Stocks Up 510% and 910% in 2 Years to Buy Now, According to Wall Street",Nvidia and Meta Platforms led the Nasdaq-100 higher over the last two years.,The Motley Fool,Positive,META|NVDA,,https://www.fool.com/investing/2024/11/11/2-nasdaq-stocks-up-510-and-910-buy-now-wall-street/
2024-11-11,Should You Buy Nvidia Stock Before These Two Major Catalysts?,Nvidia has built an artificial intelligence empire,The Motley Fool,Neutral,NVDA,,https://www.fool.com/investing/2024/11/11/should-you-buy-nvidia-before-these-catalysts/
2024-11-11,"Trump's Surprise Boost To Nvidia, AI Stocks","Our theme of Internet Infrastructure Stocks which includes companies that sell hardware and software for server processors, graphics units, memory, and networking equipment, has returned over 44% year-to-date. This compares to the S&P 500 which remains up by about 25% over the same period.",Forbes,Positive,NVDA,paylimitwall,https://www.forbes.com/sites/greatspeculations/2024/11/10/trumps-surprise-boost-to-nvidia-ai-stocks/
2024-11-10,2 Numbers I'll Be Looking for on Nov. 20 When Nvidia Reports Earnings,"While many analysts and investors will be looking at revenue and profit growth, two other figures are more important to me right now.",The Motley Fool,Neutral,NVDA,earnings,https://www.fool.com/investing/2024/11/10/2-numbers-ill-be-looking-for-on-nov-20-when-nvidia/
2024-11-10,Investment strategist picks top 5 stocks for 2025,The stock market is on course to end 2024 on a high note as investors remain on the lookout for equities likely to dominate the upcoming year.,Finbold,Positive,AMZN|AXON|NVDA|PLTR|TSLA,,https://finbold.com/investment-strategist-picks-top-5-stocks-for-2025/?utm_source=snapi
2024-11-10,Magnificent Seven: Unstoppable Tech Giants or Risky Buys?,"Did you know the ""Magnificent Seven"" moniker was meant as a warning, not an endorsement? Check out the risks and rewards of owning these dominant tech stocks.",The Motley Fool,Positive,AAPL|AMZN|GOOG|GOOGL|META|MSFT|NVDA|TSLA,,https://www.fool.com/investing/2024/11/10/magnificent-7-unstoppable-giants-or-risky-buys/
2024-11-10,3 Top Artificial Intelligence Stocks to Buy in November,These AI stocks will likely remain leaders for years to come.,The Motley Fool,Positive,NVDA|PLTR|TSM,StocksToWatch,https://www.fool.com/investing/2024/11/10/top-artificial-intelligence-stocks-to-buy-in-nov/
2024-11-10,Should You Buy Nvidia Stock After It Notched 200% Gains in 2024? Wall Street Is Providing a Nearly Unanimous Answer.,Nvidia stock has been the poster child for artificial intelligence and continues to defy the odds. But is the stock still a buy?,The Motley Fool,Positive,NVDA,,https://www.fool.com/investing/2024/11/10/should-you-buy-nvidia-stock-after-it-notched-200-g/
2024-11-10,Is Palantir a Better Artificial Intelligence (AI) Stock Than Nvidia? Why Management Thinks It Is.,"On its blowout earnings release, Palantir makes its case as the best AI stock.",The Motley Fool,Positive,NVDA|PLTR,,https://www.fool.com/investing/2024/11/10/is-palantir-a-better-ai-stock-than-nvidia/
2024-11-10,Should You Buy Nvidia Stock Before Nov. 20? Wall Street Has a Clear Answer for Investors.,Wall Street is predominately bullish on artificial intelligence chipmaker Nvidia.,The Motley Fool,Positive,NVDA,,https://www.fool.com/investing/2024/11/10/buy-nvidia-stock-wall-street-has-answer-investors/
2024-11-09,"With Nvidia Replacing Intel in the Dow Jones, Is It Time to Redefine What It Means to Be a Blue Chip Stock?",Some Dow Jones components are far from passive income powerhouses.,The Motley Fool,Neutral,INTC|NVDA,,https://www.fool.com/investing/2024/11/09/nvidia-intel-dow-jones-blue-chip-dividend-stock/
2024-11-09,3 Ways Stock-Split Stocks Nvidia and Sherwin-Williams Are Modernizing the Dow Jones Industrial Average,The Dow is less representative of value and dividend stocks and more focused on general industry leadership.,The Motley Fool,Positive,NVDA|SHW,,https://www.fool.com/investing/2024/11/09/stock-split-nvidia-sherwin-williams-dow-jones/
2024-11-08,"Stock Market At Highs, Dow Jones Tests 44,000 As Nvidia Joins; Inflation Data Next","The stock market, including the Dow Jones, is at fresh heights following the election victory of Donald Trump. Now new inflation data looms.",Investors Business Daily,Neutral,NVDA,paywall,https://www.investors.com/market-trend/the-big-picture/stock-market-dow-jones-nasdaq-sp500-nvidia-tesla-inflation-data-retail-sales/
2024-11-08,"Nvidia joins Dow, surpassing Apple as world's most valuable company","NVIDIA Corp (NASDAQ:NVDA, ETR:NVD) officially joined the Dow Jones Industrial Average on Friday, underscoring the artificial intelligence (AI) chipmaker's rising prominence in the tech sector and AI-driven economy. The stock is set to close the week with a gain of roughly 9%, bolstered by demand for Nvidia's AI chips.",Proactive Investors,Positive,NVDA,,https://www.proactiveinvestors.com/companies/news/1060223?SNAPI
2024-11-08,"""Somehow, Nvidia (NVDA) Continues to Expand Its Dominance""","You may have noticed Nvidia's (NVDA) overpowering command of the trading floor, but how much farther can the company run? Megan Brantley with @LikeFolio is convinced the A.I.",Schwab Network,Positive,NVDA,,https://www.youtube.com/watch?v=yo9kTdiIxYE
2024-11-08,Nvidia replaces Intel on the Dow Jones Industrial Average,"Nvidia (NVDA) is set to replace Intel (INTC) on the Dow Jones Industrial Average (^DJI) on Friday. Intel has been a fixture in the benchmark index since 1999, but its shares have plummeted nearly 48% throughout 2024.",Yahoo Finance,Neutral,INTC|NVDA,,https://www.youtube.com/watch?v=KgaMxgIKEZo
2024-11-08,Nvidia and the history of Big Tech on the Dow,"Chipmaker Nvidia (NVDA) and paint company Sherwin-Williams (SHW) have joined the Dow Jones Industrial Average (^DJI) this Friday, replacing Intel (INTC) and Dow Inc. (DOW). Yahoo Finance markets and data editor Jared Blikre joins the Morning Brief to break down the push for more tech representation in the Dow, which historically lacked many tech stocks until companies like Microsoft (MSFT) and Intel joined during the dot-com bubble.",Yahoo Finance,Positive,NVDA,,https://www.youtube.com/watch?v=vVoHoGcI92o
2024-11-08,Why Nvidia is replacing Intel on the Dow Jones,Nvidia (NVDA) will replace Intel (INTC) in the Dow Jones Industrial Average index (^DJI). S&P Dow Jones Indices senior index analyst Howard Silverblatt joins Seana Smith and Brad Smith to break down what investors need to know and how it will affect the chipmaker's stock and the index itself.,Yahoo Finance,Neutral,INTC|NVDA,,https://www.youtube.com/watch?v=qnZPFOS_qXs
2024-11-08,ETFs to Buy on NVIDIA's Historic Journey to $3.6 Trillion,NVIDIA became the first company to exceed $3.6 trillion in market capitalization with most analysts expecting it to be far more valuable in the future.,Zacks Investment Research,Positive,NVDA,,https://www.zacks.com/stock/news/2367607/etfs-to-buy-on-nvidia-s-historic-journey-to-3-6-trillion?cid=CS-STOCKNEWSAPI-FT-etf_news_and_commentary-2367607
2024-11-08,Nvidia's stock joins the Dow today. Here's what to know.,Nvidia's stock is now a below-average member of the 128-year-old Dow Jones Industrial Average.,Market Watch,Positive,NVDA,paylimitwall,https://www.marketwatch.com/story/nvidias-stock-joins-the-dow-today-heres-what-to-know-e6aef543
2024-11-08,What Nvidia Investors Should Know About Super Micro Computer Stock Crashing,Super Micro Computer shared recent updates about its partnership with Nvidia.,The Motley Fool,Neutral,NVDA|SMCI,podcast,https://www.fool.com/investing/2024/11/08/what-nvidia-investors-should-know-about-super-micr/
