date,title,text,source_name,sentiment,tickers,topics,url
2024-11-19,"Nvidia's Blackwell cooling issues were resolved months ago, chip experts say","Nvidia's Blackwell chip presents cooling challenges for customers. Reports that overheating will slow the Blackwell ramp are ""overblown,"" according to Semianalysis.",Business Insider,Positive,NVDA,paywall,https://www.businessinsider.com/nvidia-blackwell-chips-liquid-cooling-issues-2024-11
2024-11-19,Nvidia Rallies 4% Ahead Of Earnings: What To Expect From ‘Most Important' Stock's Report,"Nvidia shares rallied Tuesday as investors prepare for the artificial intelligence leader's quarterly earnings results due later this week, a report described as the most crucial upcoming event for the hot but rocky stock market.",Forbes,Positive,NVDA,paylimitwall,https://www.forbes.com/sites/dereksaul/2024/11/19/nvidia-rallies-4-ahead-of-earnings-what-to-expect-from-most-important-stocks-report/
2024-11-19,Nvidia Rallies 5% Ahead Of Earnings: What To Expect From ‘Most Important' Stock's Report,"Nvidia shares rallied Tuesday as investors prepare for the artificial intelligence leader's quarterly earnings results due later this week, a report described as the most crucial upcoming event for the hot but rocky stock market.",Forbes,Positive,NVDA,paylimitwall,https://www.forbes.com/sites/dereksaul/2024/11/19/nvidia-rallies-5-ahead-of-earnings-what-to-expect-from-most-important-stocks-report/
2024-11-19,Can Nvidia Live Up To Lofty Expectations?,"NVDA is the company driving the AI Boom, so any hints of caution or a slowdown will likely not be taken kindly by the market. The company trades with an estimated 2025 price-to-sales ratio of 27.9x. Typically, an earnings triple play results in an upside share-price reaction, but as we saw last quarter with NVDA when a triple play becomes the norm, sometimes it's not enough.",Seeking Alpha,Negative,NVDA,paylimitwall,https://seekingalpha.com/article/4738779-can-nvidia-live-up-to-lofty-expectations
2024-11-19,Nvidia earnings are on deck. Here are the 5 big things to know.,Nvidia's fiscal third-quarter report is due out after Wednesday's closing bell.,Market Watch,Neutral,NVDA,earnings|paylimitwall,https://www.marketwatch.com/story/nvidia-earnings-are-on-deck-here-are-the-5-big-things-to-know-b94f8aa4
2024-11-19,"NVDA Seeks to Hold ""One-Horse Race"" in Earnings",Can Nvidia (NVDA) meet earnings expectations? It's the biggest question on Wall Street's mind ahead of tomorrow's monumental report.,Schwab Network,Neutral,NVDA,earnings,https://www.youtube.com/watch?v=_wcxYJLMqLs
2024-11-19,Nvidia Earnings: Expect The Unexpected (Technical Analysis),"The assent to our ultimate target of $200 for Nvidia Corporation can be initiated on Wednesday following the closing bell when the latest earnings are released. All eyes will be on the companies results from their latest innovation, “The Blackwell Chip.”. With revenue growing steadily over the past two years, Wall Street is bracing itself to see if Nvidia can come out with another earnings surprise that signifies there is still room to drive the tech sector higher.",Seeking Alpha,Neutral,NVDA,earnings|tanalysis|paylimitwall,https://seekingalpha.com/article/4738757-nvidia-earnings-expect-the-unexpected-technical-analysis
2024-11-19,"Nvidia remains extremely well-positioned for growth, says KeyBanc's John Vinh","John Vinh, senior research analyst at KeyBanc Capital Markets, joins CNBC's 'The Exchange' to discuss what he's expecting from Nvidia's earnings, his outlook on chipmakers for 2025, and more.",CNBC Television,Positive,NVDA,,https://www.youtube.com/watch?v=BtY2E10_oGk
2024-11-19,Nvidia earnings looming large over the market,The Investment Committee debate what's in store for Nvidia as they report earnings tomorrow after the bell. They also discuss the top AI plays beyond Nvidia.,CNBC Television,Neutral,NVDA,earnings,https://www.youtube.com/watch?v=CqoGlsz_GKE
2024-11-19,Will Data Center Results Drive Nvidia Shares Higher?,"It's nearly time again for beloved Nvidia NVDA to deliver its quarterly results, with the release undoubtedly the most closely watched of the Q3 cycle. Other players involved in the AI frenzy have delivered their results, which have overall shown underlying momentum and robust demand.",Zacks Investment Research,Positive,NVDA,,https://www.zacks.com/commentary/2371825/will-data-center-results-drive-nvidia-shares-higher?cid=CS-STOCKNEWSAPI-FT-investment_ideas-2371825
2024-11-19,NVIDIA Set to Beat Estimates in Q3 Earnings: ETFs to Buy,NVIDIA is likely to beat earnings estimates and most analysts have raised their price target on the stock.,Zacks Investment Research,Positive,NVDA,earnings,https://www.zacks.com/stock/news/2372229/nvidia-set-to-beat-estimates-in-q3-earnings-etfs-to-buy?cid=CS-STOCKNEWSAPI-FT-etf_news_and_commentary-2372229
2024-11-19,Nvidia's Run:ai deal to get EU antitrust decision by Dec. 20,"EU antitrust regulators will make a decision on U.S. chipmaker Nvidia's proposed acquisition of Israeli AI startup Run:ai by Dec. 20, according to a European Commission filing.",Reuters,Neutral,NVDA,,https://www.reuters.com/technology/artificial-intelligence/nvidias-runai-deal-get-eu-antitrust-decision-by-dec-20-2024-11-19/
2024-11-19,NVIDIA Q3 Earnings Preview: AI Boom and Datacenter Growth Set to Shine,NVDA's overall Q3 performance is likely to have benefited from increasing investments in generative AI across the datacenter end market.,Zacks Investment Research,Positive,NVDA,earnings,https://www.zacks.com/stock/news/2371982/nvidia-q3-earnings-preview-ai-boom-and-datacenter-growth-set-to-shine?cid=CS-STOCKNEWSAPI-FT-analyst_blog|earnings_preview-2371982
2024-11-19,Nvidia's Upcoming Q3 Is Unlikely To Surprise You,"I don't think Nvidia Corporation's upcoming Q3 FY2025 numbers will really surprise investors — demand is predictably outstripping supply, so I expect another profit and positive comments from management. Nvidia's strategic focus on AI and accelerated computing positions it for long-term growth, with significant contributions from generative AI and model training workloads. On the other hand, I think the “beat size” will continue to fall, which could lead to a mixed reaction from market participants.",Seeking Alpha,Positive,NVDA,paylimitwall,https://seekingalpha.com/article/4738645-nvidia-upcoming-q3-is-unlikely-to-surprise-you
2024-11-19,Nvidia's Blackwell Chips Overheat: Will Q3 Earnings Cool Investor Concerns?,Nvidia Corp will report its third-quarter earnings on Wednesday. Wall Street expects 75 cents in EPS and $33.12 billion in revenues as the company reports after market hours.,Benzinga,Negative,NVDA,earnings|paywall,https://www.benzinga.com/trading-ideas/technicals/24/11/42063336/nvidia-blackwell-chips-face-heat-will-q3-earnings-cool-investor-concerns?utm_source=snapi
2024-11-19,Hitachi Vantara Announces Hitachi iQ for Trusted Data Infrastructure Solutions for Modern AI Systems with NVIDIA HGX Platform,"Hitachi iQ certified solutions and reference architectures — built on NVIDIA accelerated computing and AI software — enhance ease of deployment, operations, and maintenance of AI systems SANTA CLARA, Calif. , Nov. 19, 2024 /PRNewswire/ -- Hitachi Vantara, the data storage, infrastructure, and hybrid cloud management subsidiary of Hitachi, Ltd.",PRNewsWire,Neutral,NVDA,PressRelease,https://www.prnewswire.com/news-releases/hitachi-vantara-announces-hitachi-iq-for-trusted-data-infrastructure-solutions-for-modern-ai-systems-with-nvidia-hgx-platform-302309869.html
2024-11-19,"These Are the 5 Top-Performing Stocks in the Dow Jones Industrial Average, With 2024 Almost Over","These Are the 5 Top-Performing Stocks in the Dow Jones Industrial Average, With 2024 Almost Over",The Motley Fool,Positive,AXP|GS|JPM|NVDA|TRV|WMT,,https://www.fool.com/investing/2024/11/19/these-are-the-5-top-performing-stocks-in-the-dow-j/
2024-11-19,Dow Jones: Geopolitical Tensions Hit Futures as Walmart and Nvidia Take Focus,"Dow Jones futures fall 220 points as geopolitical tensions spike. Walmart shines with strong earnings, while Nvidia's results are eagerly awaited.",FXEmpire,Neutral,NVDA|WMT,futures,https://www.fxempire.com/forecasts/article/dow-jones-geopolitical-tensions-hit-futures-as-walmart-and-nvidia-take-focus-1477281
2024-11-19,Hon Hai Technology Group (Foxconn) Teams With 2 Taiwan Hospitals To Use NVIDIA-enabled Taipei-1 Supercomputer,"MOEA ""Big A+"" program to accelerate AI innovation in medicine  TAIPEI , Nov. 19, 2024 /PRNewswire/ -- Hon Hai Technology Group (""Foxconn"") (TWSE:2317), in partnership with two Taiwanese hospitals, has been selected for the Taiwan government-backed ""Big A+"" program that will give the world's largest electronics manufacturing service provider access to one of the world's most powerful supercomputers to accelerate AI-applied innovations for medicine. Foxconn teams up with Taichung Veterans General Hospital and Cardinal Tien Hospital for the ""Pioneers for Innovation Leadership on Technology Program"", referred to as the Big A+ program, a Ministry of Economic Affairs initiative.",PRNewsWire,Neutral,HNHPF|NVDA,PressRelease,https://www.prnewswire.com/news-releases/hon-hai-technology-group-foxconn-teams-with-2-taiwan-hospitals-to-use-nvidia-enabled-taipei-1-supercomputer-302309961.html
2024-11-19,Prediction: Nvidia Will Be the World's First $4 Trillion Company,Prediction: Nvidia Will Be the World's First $4 Trillion Company,The Motley Fool,Neutral,NVDA,,https://www.fool.com/investing/2024/11/19/prediction-nvidia-world-first-4-trillion-stock/
2024-11-19,Here's how options traders are playing Nvidia earnings this week,Indicators pointing to a higher stock price after Nvidia's third-quarter earnings announcement on Nov. 20.,Market Watch,Positive,NVDA,earnings|paylimitwall,https://www.marketwatch.com/story/heres-how-options-traders-are-playing-nvidia-earnings-this-week-8001ffc6
2024-11-19,Nvidia Stock Gains. Watch These Key Figures Ahead of the AI Chip Maker's Earnings.,Nvidia reports earnings after the bell on Wednesday. The focus will be on how quickly it can ramp up Blackwell sales in the face of any technical challenges.,Barrons,Positive,NVDA,paywall,https://www.barrons.com/articles/nvidia-stock-price-earnings-guidance-analyst-21012cca
2024-11-19,Nvidia must show Blackwell chip can drive growth in earnings report,Nvidia is on a historic run as its GPU chips are the technology industry's tool of choice for making and deploying generative AI software. Investors will want to see whether Nvidia can continue to grow at a fierce rate when the company reports its third-quarter earnings on Wednesday.,CNBC,Neutral,NVDA,earnings,https://www.cnbc.com/2024/11/19/nvidia-must-show-blackwell-chip-can-drive-growth-in-earnings-report.html
2024-11-19,Can Nvidia Stock Lose 50%?,"Nvidia stock has been a standout performer in the AI boom, rising by over 180% year-to-date. However, could this remarkable run reverse, and the stock fall by over 50% from current levels?",Forbes,Negative,NVDA,paylimitwall,https://www.forbes.com/sites/greatspeculations/2024/11/19/can-nvidia-stock-lose-50/
2024-11-19,2 Reasons to Buy Nvidia Stock Hand Over Fist Before Thursday -- and 2 Reasons to Hold Off,2 Reasons to Buy Nvidia Stock Hand Over Fist Before Thursday -- and 2 Reasons to Hold Off,The Motley Fool,Positive,NVDA,,https://www.fool.com/investing/2024/11/19/3-reasons-to-buy-nvidia-stock-hand-over-fist-befor/
2024-11-19,Nvidia's options primed for $300-billion price swing after earnings,"Options traders are primed for a nearly $300-billion swing in Nvidia's market value following the chipmaker's quarterly results on Wednesday, U.S. options market data showed.",Reuters,Neutral,NVDA,earnings,https://www.reuters.com/technology/nvidias-options-primed-300-billion-price-swing-after-earnings-2024-11-19/
2024-11-19,Nvidia Stock Investors Got Great News From Elon Musk,Nvidia Stock Investors Got Great News From Elon Musk,The Motley Fool,Neutral,NVDA,CEO|podcast,https://www.fool.com/investing/2024/11/19/nvidia-stock-investors-got-great-news-from-elon-mu/
2024-11-19,Nvidia Stock Has Done This After Its Last Four Quarterly Results. Here's What It May Do After Nov. 20,Nvidia Stock Has Done This After Its Last Four Quarterly Results. Here's What It May Do After Nov. 20,The Motley Fool,Neutral,NVDA,earnings,https://www.fool.com/investing/2024/11/18/nvidia-stock-has-done-this-after-its-last-four-qua/
2024-11-19,Jim Cramer on why Nvidia investors shouldn't overreact to the latest Blackwell report,'Mad Money' host Jim Cramer looks at the recent move down in Nvidia.,CNBC Television,Neutral,NVDA,cramer|madmoney,https://www.youtube.com/watch?v=D6EQeiq_tm0
2024-11-19,Jim Cramer weighs Nvidia stock after report of Blackwell AI chip overheating,"CNBC's Jim Cramer discussed the stock of Nvidia in light of a report that the artificial intelligence darling is having overheating problems with servers for its newest graphics chips. The Information reported that Nvidia's AI Blackwell chips overheat when connected to custom servers, and it had asked suppliers to change server rack designs several times.",CNBC,Negative,NVDA,cramer,https://www.cnbc.com/2024/11/18/cramer-weighs-nvidia-after-blackwell-ai-chip-overheating-report.html
2024-11-18,Markets Mixed Monday: NVIDIA Forecast and More,Markets are back to seeing a post-election stock market reducing regulations and letting valuations ride higher.,Zacks Investment Research,Neutral,NVDA,,https://www.zacks.com/stock/news/2371786/markets-mixed-monday-nvidia-forecast-and-more?cid=CS-STOCKNEWSAPI-FT-ahead_of_wall_street-2371786
2024-11-18,Nvidia's Blackwell chip overheats ahead of Q3 earnings,"Nvidia (NVDA) shares fall following reports of overheating issues with its Blackwell chips, ahead of the company's third-quarter earnings report this Wednesday. Rosenblatt Securities senior research analyst Hans Mosesmann joins Market Domination Co-hosts Julie Hyman and Josh Lipton to share that some of the headwinds Nvidia is facing stem from the company's push to advance technology at a faster pace than the supply chain can support.",Yahoo Finance,Negative,NVDA,,https://www.youtube.com/watch?v=4gspIwMrVDE
2024-11-18,Google and Nvidia Team Up on Quantum Computer Development,Google Quantum AI is using the Nvidia CUDA-Q platform and the Nvidia Eos supercomputer to help develop its next-generation quantum computing devices.,PYMNTS,Positive,GOOG|GOOGL|NVDA,,https://www.pymnts.com/technology/2024/google-and-nvidia-team-up-on-quantum-computer-development/?utm_source=snapi
2024-11-18,Indexes Mostly Higher As Trump Rally Tries To Get Back On Track; Nvidia Trips On Blackwell Fears,"The Dow fell but the S&P 500 and the Nasdaq gained on Monday, rebounding from the 21-day moving average. The post Indexes Mostly Higher As Trump Rally Tries To Get Back On Track; Nvidia Trips On Blackwell Fears appeared first on Investor's Business Daily.",Investors Business Daily,Positive,NVDA,paywall,https://www.investors.com/market-trend/the-big-picture/stock-market-dow-jones-sp500-nasdaq-trump-rally-nvidia-smci/
2024-11-18,Melius' Ben Reitzes looks ahead to Nvidia earnings,"Ben Reitzes, Melius Research Head of Technology Research, joins 'Closing Bell Overtime' to talk what to expect from Nvidia earnings.",CNBC Television,Neutral,NVDA,,https://www.youtube.com/watch?v=EEsYEumPewU
2024-11-18,Nvidia Q3 Preview: This Is The Big Quarter,"Nvidia Corporation's stock has surged 31.32% driven by optimism around the Blackwell GPU, but I believe this enthusiasm is overly optimistic and exposes valuation risks. The Blackwell GPU faces overheating issues in server configurations, complicating its adoption and potentially increasing costs for hyperscalers, which could impact Nvidia's sales. Despite upward revisions for Q3 earnings, Nvidia's high valuation and reliance on Blackwell's success make its current stock price unsustainable, warranting a strong sell recommendation.",Seeking Alpha,Positive,NVDA,paylimitwall,https://seekingalpha.com/article/4738495-nvidia-q3-preview-this-is-the-big-quarter
2024-11-18,"Nvidia Q3 earnings: All eyes will be on AI demand, growth","All eyes are on Nvidia (NVDA) as the semiconductor giant is set to release its third quarter results on Wednesday, November 20. The Sevens Report founder and president Tom Essaye joins Morning Brief to discuss what investors are looking for in the report.",Yahoo Finance,Neutral,NVDA,earnings,https://www.youtube.com/watch?v=KsZ8xKQ2ALs
2024-11-18,This Is Why NVIDIA Joined the Dow; And Why It's Time to Buy,"NVIDIA's entry into the Dow, the release of new Blackwell chips, and its solid GPU market position make it an enticing buy.",Zacks Investment Research,Positive,NVDA,,https://www.zacks.com/stock/news/2371774/this-is-why-nvidia-joined-the-dow-and-why-it-s-time-to-buy?cid=CS-STOCKNEWSAPI-FT-analyst_blog|investment_ideas-2371774
2024-11-18,Stock Market Today: Nasdaq Jumps Ahead of Nvidia Earnings,It was a mostly positive start to a new week of pricing in more Donald Trump.,Kiplinger,Positive,NVDA,marketclose,https://www.kiplinger.com/investing/stocks/stock-market-today-nasdaq-jumps-ahead-of-nvidia-earnings
2024-11-18,"NVDA, PANW, WMT: Charting the Week's Biggest Earnings","@verifiedinvesting's Gareth Soloway charts the biggest names reporting earnings this week. For Nvidia (NVDA), he expects possible breakdowns if astronomical expectations aren't met.",Schwab Network,Negative,NVDA|PANW|WMT,earnings,https://www.youtube.com/watch?v=77QoG3xdSCQ
2024-11-18,Investors Wait For Nvidia Earnings,"Chips stock edged higher with the exception of Nvidia ahead of their earnings on Wednesday as reports emerge that design of its AI chips have hit a snag. Sylvia Jablonski, Defiance ETFs CEO and CIO, joins Caroline Hyde to discuss on ""Bloomberg Technology.",Bloomberg Technology,Negative,NVDA,earnings,https://www.youtube.com/watch?v=mXKgN3PTwKk
2024-11-18,"A Must See Chart For Prudent Investors, Trump To Help Tesla Dominate, Nvidia Heat Problem","To gain an edge, this is what you need to know today.",Benzinga,Neutral,NVDA|TSLA,paywall,https://www.benzinga.com/general/market-summary/24/11/42046649/a-must-see-chart-for-prudent-investors-trump-to-help-tesla-dominate-nvidia-heat-problem?utm_source=snapi
2024-11-18,Nvidia's earnings could determine the stock market's near-term direction: BofA,"The chip maker's earnings could pose a greater risk to the S&P 500 than the jobs report, CPI or the Fed meeting, BofA anaylsts say.",Market Watch,Neutral,NVDA,earnings|paylimitwall,https://www.marketwatch.com/story/nvidias-earnings-could-determine-the-stock-markets-near-term-direction-bofa-898db3f5
2024-11-18,nVent Collaborates with NVIDIA on AI-Ready Liquid Cooling Solutions,"LONDON--(BUSINESS WIRE)--nVent Electric plc (NYSE:NVT) (“nVent”), a global leader in electrical connection and protection solutions, today announced that it is collaborating with NVIDIA (NYSE:NVDA) to deploy liquid cooling solutions at scale supporting the NVIDIA GB200 NVL72 and next-generation platforms. The collaboration is expected to deliver cutting-edge, built-to-spec liquid cooling technology to enhance the performance and energy efficiency of NVIDIA-powered data centers. nVent is a leade.",Business Wire,Neutral,NVDA|NVT,PressRelease,https://www.businesswire.com/news/home/20241118649897/en/nVent-Collaborates-with-NVIDIA-on-AI-Ready-Liquid-Cooling-Solutions/
2024-11-18,NVIDIA Announces Omniverse Real-Time Physics Digital Twins With Industry Software Leaders,"Blueprint for Interactive Virtual Wind Tunnels Enables Unprecedented Computer-Aided Engineering Exploration for Altair, Ansys, Cadence, Siemens and More Blueprint for Interactive Virtual Wind Tunnels Enables Unprecedented Computer-Aided Engineering Exploration for Altair, Ansys, Cadence, Siemens and More",GlobeNewsWire,Neutral,NVDA,PressRelease,https://www.globenewswire.com/news-release/2024/11/18/2983079/0/en/NVIDIA-Announces-Omniverse-Real-Time-Physics-Digital-Twins-With-Industry-Software-Leaders.html
2024-11-18,Neural Concept to Unveil Real-Time Digital Twin Capabilities at Supercomputing 24 Using NVIDIA Omniverse Blueprint for Real-time Computer-aided Engineering Digital Twins,"ATLANTA--(BUSINESS WIRE)--Neural Concept, the leading end-to-end 3D AI platform for engineering intelligence, announced today at Supercomputing 2024 that its 3D AI platform will leverage the NVIDIA Omniverse Blueprint. This integration enables Neural Concept customers to create real-time interactive digital twins at scale for computer-aided engineering (CAE) product development. The news follows Neural Concept's announcement of its first U.S. office and 10 new U.S. original equipment manufactur.",Business Wire,Neutral,NVDA,PressRelease,https://www.businesswire.com/news/home/20241118832509/en/Neural-Concept-to-Unveil-Real-Time-Digital-Twin-Capabilities-at-Supercomputing-24-Using-NVIDIA-Omniverse-Blueprint-for-Real-time-Computer-aided-Engineering-Digital-Twins/
2024-11-18,NVIDIA Accelerates Google Quantum AI Processor Design With Simulation of Quantum Device Physics,NVIDIA CUDA-Q Platform Enables Google Quantum AI Researchers to Create Massive Digital Model of Its Quantum Computer to Solve Design Challenges NVIDIA CUDA-Q Platform Enables Google Quantum AI Researchers to Create Massive Digital Model of Its Quantum Computer to Solve Design Challenges,GlobeNewsWire,Neutral,NVDA,PressRelease,https://www.globenewswire.com/news-release/2024/11/18/2983076/0/en/NVIDIA-Accelerates-Google-Quantum-AI-Processor-Design-With-Simulation-of-Quantum-Device-Physics.html
2024-11-18,NVIDIA Opens BioNeMo to Scale Digital Biology for Global Biopharma and Scientific Industry,"Argonne National Laboratory, Flagship Pioneering, Terray, Weights & Biases and Dozens More Organizations Among Contributors Advancing Biomolecular Science Argonne National Laboratory, Flagship Pioneering, Terray, Weights & Biases and Dozens More Organizations Among Contributors Advancing Biomolecular Science",GlobeNewsWire,Neutral,NVDA,PressRelease,https://www.globenewswire.com/news-release/2024/11/18/2983077/0/en/NVIDIA-Opens-BioNeMo-to-Scale-Digital-Biology-for-Global-Biopharma-and-Scientific-Industry.html
2024-11-18,3 Reasons to Buy Nvidia Stock Before November 20,3 Reasons to Buy Nvidia Stock Before November 20,The Motley Fool,Positive,NVDA,,https://www.fool.com/investing/2024/11/18/3-reasons-to-buy-nvidia-stock-before-november-20/
2024-11-18,Has NVIDIA Stock (NVDA) Become the Market's Newest “Meme Stock”,"NVIDIA's valuation largely rides on AI hype. Its P/E ratio of ~90 reflects immense growth expectations, similar to speculative meme stocks but grounded in real demand.",24/7 Wall Street,Neutral,NVDA,,https://247wallst.com/investing/2024/11/18/has-nvidia-stock-nvda-become-the-markets-newest-meme-stock/?utm_source=snapi
2024-11-18,Nvidia must get back to 'double-digit' beats: Portfolio mgr.,"Investors are eagerly awaiting Nvidia's (NVDA) third-quarter results, which will be released on Wednesday, November 20. Independent Solutions Wealth Management portfolio manager Paul Meeks joins Catalysts to discuss his outlook on the report.",Yahoo Finance,Neutral,NVDA,,https://www.youtube.com/watch?v=2HKfVbVvJCo
2024-11-18,Nvidia Q3 earnings preview: is NVDA stock overvalued ahead of results?,All eyes are on Nvidia Corp (NASDAQ: NVDA) this week as it warms up to report its quarterly earnings on November 20th. The consensus is for this artificial intelligence behemoth to double its data center business in Q3.,Invezz,Neutral,NVDA,,https://invezz.com/news/2024/11/18/nvidia-q3-earnings-preview-is-nvda-stock-overvalued-ahead-of-results/?utm_source=snapi
2024-11-18,Nvidia Stock Price Levels to Watch as Earnings Report Looms,Nvidia (NVDA) shares are in the spotlight Monday ahead of the artificial intelligence (AI) darling's quarterly results later this week and following a report that said the company's next-generation AI chips have encountered issues overheating in servers.,Investopedia,Neutral,NVDA,earnings,https://www.investopedia.com/nvidia-stock-price-levels-to-watch-as-earnings-report-looms-8746934
2024-11-18,NVDY ETF's Efficiency Is Uncanny And Shouldn't Be Counted On Going Forward Despite Nvidia Potential,"The NVDY ETF offers high income by sacrificing NVDA's upside potential, and has achieved impressive returns since its inception. The pattern of monthly NVDA returns has been especially accommodating for NVDY's structure, but I don't expect that to continue. Nvidia Corp itself remains a reasonable portfolio holding for patient long-term investors.",Seeking Alpha,Positive,NVDA,paylimitwall,https://seekingalpha.com/article/4738282-nvdy-etf-efficiency-uncanny-shouldnt-be-counted-on-going-forward-despite-nvidia-potential
2024-11-18,Markets Wait for Last Significant Week of Q3 Earnings Season,Markets Wait for Last Significant Week of Q3 Earnings Season.,Zacks Investment Research,Neutral,NVDA,earnings,https://www.zacks.com/stock/news/2371645/markets-wait-for-last-significant-week-of-q3-earnings-season?cid=CS-STOCKNEWSAPI-FT-economic_highlights-2371645
2024-11-18,Nvidia: Pre-Earning Analysis Of Nvidia Is Positive (Technical Analysis),"Despite current Red Zone caution, other technical tools indicate higher prices for Nvidia Corporation, with a price target of $192 by March. Because prices are against the upper, long-term Bollinger Band, investors should expect a gradual advance and not a sudden price surge. Long-term RSI shows bullish relative strength, with a current RSI at 47.5, indicating no intermediate-term correction for now.",Seeking Alpha,Positive,NVDA,tanalysis|paylimitwall,https://seekingalpha.com/article/4738402-nvidia-pre-earning-analysis-of-nvidia-is-positive-technical-analysis
