date,title,text,source_name,sentiment,tickers,topics,url
2024-11-30,Nvidia's Deceleration Attributed To Law Of Large Numbers -- Top AI Leadership,"Nvidia Corporation remains the clear leader in the AI race, as observed in the double beat FQ3 '25 results and promising FQ4 '25 guidance. While there appears to be a deceleration in growth, readers must note that it is merely attributed to the law of large numbers, as the consensus raise their forward estimates. If anything, Nvidia may continue to benefit from this super cycle of cloud computing, as AI adoption accelerates across the Big Tech, SMB companies, and governments.",Seeking Alpha,Positive,NVDA,paylimitwall,https://seekingalpha.com/article/4740722-nvidia-deceleration-attributed-to-law-of-large-numbers-top-ai-leadership
2024-11-30,Nvidia's Growing Faster Than You Think. This Table Proves It.,"Like clockwork, Nvidia (NVDA 2.15%) delivered another round of explosive growth in its third-quarter earnings report, but investors seemed to be missing the most impressive part of the performance. The company didn't mention it in the earnings call or press release, consigning it instead to the ""CFO Commentary"" section of its earnings report.",The Motley Fool,Positive,NVDA,,https://www.fool.com/investing/2024/11/30/nvidias-growing-faster-than-you-think-this-table/
2024-11-29,Better Buy Now: Nvidia or the Other 29 Stocks in the Dow Jones Industrial Average?,"Nvidia (NVDA 2.15%) replaced Intel in the Dow Jones Industrial Average (^DJI 0.42%) earlier this month, adding even more tech and semiconductor exposure to the historic index.",The Motley Fool,Neutral,NVDA,,https://www.fool.com/investing/2024/11/29/better-buy-now-nvidia-dow-dividend-value-stock/
2024-11-29,Will Nvidia's Blockbuster Results Be Enough to Send the Stock Higher?,"Nvidia (NVDA 2.15%) has been in sizzling form on the stock market in 2024, thanks to the stunning growth the company has been clocking quarter after quarter, which explains why the market was awaiting its fiscal 2025 third-quarter results (for the three months ended Oct. 27) with bated breath.",The Motley Fool,Positive,NVDA,,https://www.fool.com/investing/2024/11/29/will-nvidias-blockbuster-results-be-enough-to-send/
2024-11-29,"Tech sector rebounds: Nvidia, Alphabet, Microsoft in focus","The tech sector bounces back, with the Technology Select Sector SPDR Fund (XLK) making up for losses recorded before the Thanksgiving holiday. Brian Sozzi and Julie Hyman take a look at the top stories for Big Tech companies, including Nvidia (NVDA), Alphabet (GOOG, GOOGL), and Microsoft (MSFT), on Catalysts.",Yahoo Finance,Positive,GOOG|GOOGL|MSFT|NVDA,,https://www.youtube.com/watch?v=MCltW--eE6Y
2024-11-29,Magnificent Seven Stocks: Nvidia Stock Rebounds; Tesla Races Higher,"Nvidia stock rebounded Friday from a key support level, while Tesla raced higher, looking to snap a three-day losing streak. The post Magnificent Seven Stocks: Nvidia Stock Rebounds; Tesla Races Higher appeared first on Investor's Business Daily.",Investors Business Daily,Positive,NVDA|TSLA,paywall,https://www.investors.com/research/magnificent-seven-stocks/
2024-11-29,5 Low-Leverage Stocks to Buy After Unfavorable Consumer Price Data,"The majority of U.S. stock indices ended in the red on Nov. 28, following an unfavorable inflation data release, reflecting an uptick in the nation's monthly consumer price.",Zacks Investment Research,Neutral,CCB|FOX|FRPT|IDCC|NVDA,StocksToWatch,https://www.zacks.com/stock/news/2377104/5-low-leverage-stocks-to-buy-after-unfavorable-consumer-price-data?cid=CS-STOCKNEWSAPI-FT-analyst_blog|rw-2377104
2024-11-29,Does Nvidia (NVDA) Have the Potential to Rally 27.87% as Wall Street Analysts Expect?,"The consensus price target hints at a 27.9% upside potential for Nvidia (NVDA). While empirical research shows that this sought-after metric is hardly effective, an upward trend in earnings estimate revisions could mean that the stock will witness an upside in the near term.",Zacks Investment Research,Positive,NVDA,,https://www.zacks.com/stock/news/2377070/does-nvidia-nvda-have-the-potential-to-rally-27-87-as-wall-street-analysts-expect?cid=CS-STOCKNEWSAPI-FT-tale_of_the_tape|consensus_price_target-2377070
2024-11-29,What Is Going On With Nvidia Stock?,"In this video, I will cover recent updates regarding Nvidia (NVDA 2.49%). Watch the short video to learn more, consider subscribing, and click the special offer link below.",The Motley Fool,Neutral,NVDA,podcast,https://www.fool.com/investing/2024/11/29/what-is-going-on-with-nvidia-stock/
2024-11-29,Nvidia: Showing Strength Modernizing Computing And Creating AI Factories,"Nvidia Corporation's AI hardware demand surged post-ChatGPT, driving record revenues and operating income, showcasing their strength in modernizing computing and building AI factories despite architectural transitions. Nvidia's dominance is bolstered by the widespread adoption of their CUDA software, making competitors' hardware less appealing despite potential price advantages. CEO Huang emphasizes Nvidia's role in the AI revolution, modernizing data centers and creating AI factories, predicting tremendous growth in AI-driven industries.",Seeking Alpha,Positive,NVDA,paylimitwall,https://seekingalpha.com/article/4741143-nvidia-showing-strength-modernizing-computing-and-creating-ai-factories
2024-11-29,Nvidia: Rightfully Declining Further Into Potential Buying Territory,"Nvidia Corporation's downward trajectory is the right direction to make it attractive for additional accumulation. In light of normal DSO and strong free cash flow, concerns about a single data point showing increased accounts receivables seem overblown. Nvidia's revenue is backed by increased CAPEX from major tech giants, though reliance on few customers poses long-term concentration risks and CAPEX growth decelerates.",Seeking Alpha,Negative,NVDA,paylimitwall,https://seekingalpha.com/article/4741134-nvidia-rightfully-declining-further-into-potential-buying-territory
2024-11-29,Why Does Nvidia Make Up a Smaller Share of the Dow Jones Than the S&P 500 or Nasdaq-100?,"At the time of this writing, Nvidia (NVDA -1.15%) is up by 186.6% year to date, pole-vaulting its market capitalization above those of Apple and Microsoft to make it the most valuable company in the world (again). But Friday's 3.2% sell-off in Nvidia left Apple within a whisker of claiming the No.",The Motley Fool,Positive,NVDA,,https://www.fool.com/investing/2024/11/29/nvidia-dow-jones-sp-500-nasdaq-index/
2024-11-29,Forget Big Tech - I'll Take Dividend Stalwarts Any Day,"Big Tech dominates markets but faces risks like slowing growth, AI dependency, and inflated valuations. Dividend stalwarts offer a safer, smarter alternative. Dividend stocks, like those in VYM and SCHD ETFs, have matched or beat tech returns since 2021, fueled by strong cash flow, low risks, and reliable growth. By focusing on dividend stalwarts, investors can achieve long-term growth, income, and stability—outperforming tech-heavy portfolios over time.",Seeking Alpha,Positive,AAPL|ABBV|AMZN|AXP|CVX|GOOG|GOOGL|HD|JNJ|JPM|KO|META|NVDA|QQQ|SCHD|VYM|VZ|XOM,dividend|paylimitwall,https://seekingalpha.com/article/4740947-forget-big-tech-ill-take-dividend-stalwarts-any-day
2024-11-29,How did Nvidia expand nearly 20-fold in just over 20 years?,This post originally appeared in the Insider Today newsletter. You can sign up for Business Insider's daily newsletter here.,Business Insider,Positive,NVDA,paywall,https://www.businessinsider.com/nvidia-jesen-huang-company-workforce-growth-stock-price-climbing-2024-11
2024-11-29,Intel's annual median pay has been stagnant compared to peers like Nvidia and Microsoft,"Intel's median employee pay rose 4% in five years, lagging behind other tech firms. Other tech companies like Nvidia and Microsoft increased pay by at least 12%.",Business Insider,Negative,INTC|MSFT|NVDA,paywall,https://www.businessinsider.com/intel-pay-big-tech-salaries-2024-11
2024-11-29,Nvidia Stock Rises. Why the Good News Is Back.,Nvidia stock has been on a disappointing run since its earnings last week but the good vibes looked set to return in a holiday-shortened session Friday.,Barrons,Positive,NVDA,paywall,https://www.barrons.com/articles/nvidia-stock-amd-chip-ai-a86cfa0a
2024-11-29,Prediction: Nvidia Stock Will Soar in 2025. Here's Why.,The past couple of years have been a nonstop thrill ride for Nvidia (NVDA -1.15%) investors. The company had a market cap of just $359 billion to kick off 2023.,The Motley Fool,Positive,NVDA,,https://www.fool.com/investing/2024/11/29/prediction-nvidia-stock-will-soar-in-2025-heres-wh/
2024-11-29,Wall Street sets Nvidia (NVDA) stock price for the next 12 months,"Nvidia (NASDAQ: NVDA) closed Monday at $135.34, down 1.15%, with the stock briefly falling to $132.08 during intraday trading before managing to recover slightly by the end of the session.",Finbold,Positive,NVDA,,https://finbold.com/wall-street-sets-nvidia-nvda-stock-price-for-the-next-12-months-2/?utm_source=snapi
2024-11-29,Nvidia: Why I Am Doubling Down On The Drop,"Nvidia's 1Q25 earnings beat expectations, but investor fatigue led to a muted stock response, creating a buying opportunity for long-term investors. NVDA's sales nearly doubled YoY, driven by strong data center GPU demand, with profits growing even faster than sales. The upcoming Blackwell-themed data center GPU launch in Q4 is expected to be a significant catalyst for Nvidia's sales and profit growth in 2025.",Seeking Alpha,Positive,NVDA,paylimitwall,https://seekingalpha.com/article/4741066-nvidia-stock-why-doubling-down-on-drop
2024-11-28,7 AI Stocks I Own and Won't Stop Buying,"The artificial intelligence (AI) revolution is generating unprecedented economic momentum. According to analysis from Grand View Research, market projections forecast explosive growth from $196.6 billion in 2023 to $1.8 trillion by 2030.",The Motley Fool,Positive,AAPL|JPM|LMT|NVDA|PLTR|SOUN|TSM,,https://www.fool.com/investing/2024/11/28/7-ai-stocks-i-own-and-wont-stop-buying/
2024-11-28,"Bitcoin Set to Cross $100,000 on Post-Election Rally: 4 Stocks to Buy","Stocks like COIN, BLK, ACN and NVDA are poised to gain from the ongoing Bitcoin rally.",Zacks Investment Research,Positive,ACN|BLK|COIN|NVDA,StocksToWatch,https://www.zacks.com/stock/news/2376477/bitcoin-set-to-cross-100-000-on-post-election-rally-4-stocks-to-buy?cid=CS-STOCKNEWSAPI-FT-analyst_blog|investment_ideas-2376477
2024-11-28,Is Nvidia Stock on Sale?,NVDA stock is a screaming bargain by some relative valuation metrics.,Kiplinger,Positive,NVDA,,https://www.kiplinger.com/investing/is-nvidia-stock-on-sale
2024-11-28,Is Nvidia stock seeing heavy short interest?,"Late November 2024 brought a stock market twist for semiconductor giant Nvidia (NASDAQ: NVDA), as the shares entered a notable decline after the company posted an otherwise strong quarterly report.",Finbold,Negative,NVDA,,https://finbold.com/is-nvidia-stock-seeing-heavy-short-interest/?utm_source=snapi
2024-11-28,"Global chipmakers including Nvidia, AMD brace for tougher Chinese export controls","The outgoing Biden administration is preparing to introduce additional restrictions on semiconductor equipment and artificial intelligence microchip exports to China, according to a Bloomberg report. However, “people familiar with the matter” said these measures will reportedly be less stringent than earlier proposals.",Proactive Investors,Negative,AMD|NVDA,,https://www.proactiveinvestors.com/companies/news/1061717?SNAPI
2024-11-28,36% of Nvidia's $35 Billion in Q3 Revenue Came From Just 3 Mystery Customers,"Nvidia (NVDA -1.15%) is the world's leading supplier of graphics processing units (GPUs) for data centers. Demand for the chips, which are used to develop artificial intelligence (AI), is significantly outpacing supply, and that trend is likely to continue for the foreseeable future.",The Motley Fool,Positive,NVDA,earnings,https://www.fool.com/investing/2024/11/28/36-nvidias-35-billion-revenue-3-mystery-customers/
2024-11-28,Nvidia: Potential For Growth,"NVIDIA's market cap has surpassed Apple and Microsoft, but I still see growth potential, valuing it at $189 per share, a 42% premium. NVIDIA's exceptional financial performance is driven by explosive GPU demand for AI, with significant revenue and margin growth, and strategic share repurchases. NVIDIA's platform strategy, including CUDA and AI data centers, creates high switching costs and long-term partnerships, ensuring sustained demand and competitive advantage.",Seeking Alpha,Positive,NVDA,paylimitwall,https://seekingalpha.com/article/4740864-nvidia-stock-still-potential-for-growth
2024-11-27,"Semis won't face much impact from Trump 2.0 tariffs, says Bernstein's Stacy Rasgon","Stacy Rasgon, Bernstein Research U.S. semiconductor senior analyst, joins CNBC's 'The Exchange' to discuss the impact of potential tariffs on the semiconductor sector.",CNBC Television,Positive,ADI|AMAT|AMD|AVGO|INTC|LRCX|NVDA|NXPI|QCOM|SMH|TXN,,https://www.youtube.com/watch?v=ULGdg6isVHU
2024-11-27,Expect A Slower NVIDIA As 2024 Closes,"On November 18th, the stock was featured favorably on the front page of Barron's. Contrary opinion suggests that this exposure is a negative.",Forbes,Negative,NVDA,paylimitwall,https://www.forbes.com/sites/greatspeculations/2024/11/27/expect-a-slower-nvidia-as-2024-closes/
2024-11-27,"Nvidia Slips Again On Post-Earnings Blues, New China Trade War","Nvidia stock slipped again on post-earnings worries plus growing concerns about a new trade war with China. The post Nvidia Slips Again On Post-Earnings Blues, New China Trade War appeared first on Investor's Business Daily.",Investors Business Daily,Negative,NVDA,earnings,https://www.investors.com/news/technology/nvidia-stock-nvda-earnings-china-trade-war-worries/
2024-11-27,Options Trades in AAPL and NVDA,Reuters reports Apple (AAPL) iPhone sales dipped in China last month. Nvidia (NVDA) continues to fall after hitting all-time highs last week.,Schwab Network,Negative,AAPL|NVDA,,https://www.youtube.com/watch?v=JvLt4s9RF6o
2024-11-27,As Nvidia Breaks Key Support Look Out For These Levels Below; Is Nvidia A Buy Or Sell?,Nvidia fell below the 50-day moving average on Wednesday. The post As Nvidia Breaks Key Support Look Out For These Levels Below; Is Nvidia A Buy Or Sell?,Investors Business Daily,Neutral,NVDA,paywall,https://www.investors.com/research/nvda-stock-is-nvidia-a-buy-2/
2024-11-27,"TSLA, Tariffs and Why China is Critical for NVDA's A.I. Dominance","With Elon Musk dubbed the ""First Buddy"" of the 2nd Trump Administration, John Engle looks at how that relationship may impact Tesla (TSLA) and the overall E.V. landscape.",Schwab Network,Neutral,NVDA|TSLA,Political,https://www.youtube.com/watch?v=KD5yWh3UwpM
2024-11-27,Nvidia: I Am Buying The Drop (Technical Analysis) (Rating Upgrade),"Nvidia Corporation's earnings show strong growth, with Q3 revenue up 94% YoY and data center sales driving impressive performance, despite recent share price declines. Elevated forward valuation metrics suggest a need for targeted pullbacks; Nvidia's forward P/E ratio is 46.33x, higher than most MAG-7 peers. Recent share price declines to mid-130s might offer a buying opportunity; support near the 50-day EMA suggests upside potential outweighs downside risks.",Seeking Alpha,Positive,NVDA,tanalysis|paylimitwall,https://seekingalpha.com/article/4740669-nvidia-i-am-buying-the-drop-technical-analysis-rating-upgrade
2024-11-27,Prediction: This Massive Risk Could Derail Nvidia Stock,"Demand for artificial intelligence (AI) chips, particularly ultra-powerful GPUs from Nvidia (NVDA 0.66%) used to train the most advanced AI models, appears to be insatiable. Nvidia's data center segment generated more than $30 billion in revenue during the third quarter alone, up by nearly a factor of 10 compared to two years ago.",The Motley Fool,Neutral,NVDA,,https://www.fool.com/investing/2024/11/27/prediction-this-massive-risk-could-derail-nvidia-s/
2024-11-27,"Sell Nvidia, Buy AMD Stock?","Nvidia has been the clear front runner in the generative artificial intelligence race, with its stock surging 180% this year propelling it to become the world's most valuable company with a market cap of almost $3.5 trillion. However, trading at a lofty valuation of nearly 48x consensus FY2025 earnings, future gains could be harder to come by for Nvidia stock.",Forbes,Negative,AMD|NVDA,paylimitwall,https://www.forbes.com/sites/greatspeculations/2024/11/27/sell-nvidia-buy-amd-stock/
2024-11-27,"Nvidia Stock Heads Into the Holidays Falling. Tariff Talk, Dell Earnings Haven't Helped.",Shares are down almost 7% over the past five days even though they rose slightly on Tuesday.,Barrons,Negative,DELL|NVDA,earnings|paywall,https://www.barrons.com/articles/nvidia-stock-dell-tariffs-c011c46f
2024-11-27,Is Nvidia Still the Best Artificial Intelligence (AI) Stock to Own for 2025?,"Nvidia (NVDA 0.66%) has undoubtedly been one of (if not the) best artificial intelligence (AI) stocks to own in 2023 and 2024. With 2025 nearly here, the question now shifts to: ""Is it the best AI stock for 2025?",The Motley Fool,Positive,NVDA,,https://www.fool.com/investing/2024/11/27/is-nvidia-still-the-best-artificial-intelligence-a/
2024-11-27,Better Semiconductor Stock: Nvidia vs. Taiwan Semiconductor,"Artificial intelligence has been a boon to businesses in the semiconductor industry as customers upgrade their technology to support the needs of AI systems. Arguably the biggest beneficiaries of this trend are two titans of the industry, Nvidia (NVDA 0.66%) and Taiwan Semiconductor Manufacturing (TSM -0.67%), popularly known as TSMC.",The Motley Fool,Positive,NVDA|TSM,,https://www.fool.com/investing/2024/11/27/better-semiconductor-stock-nvidia-vs-taiwan-semi/
2024-11-27,The Success of Nvidia's Blackwell Isn't the Only Reason to Buy the Stock,"Nvidia's (NVDA 0.66%) strong artificial intelligence (AI)-related growth has driven the shares up 179% so far in 2024, at the time of this writing. The stock trades at a high price-to-earnings ratio of 55, so investors understandably have high expectations for growth heading into the new year.",The Motley Fool,Positive,NVDA,,https://www.fool.com/investing/2024/11/27/success-nvidia-blackwell-only-reason-buy-stock/
2024-11-27,Billionaire Ken Griffin Sold 91% of Citadel's Stake in Palantir and Nearly Tripled His Position in This Cutting-Edge Artificial Intelligence (AI) Stock,"This has been a busy month on the news front for Wall Street. Between Election Day, earnings season, and the October inflation report, investors haven't been hurting for catalysts.",The Motley Fool,Negative,NVDA|PLTR,,https://www.fool.com/investing/2024/11/27/billionaire-ken-griffin-sold-91-stake-palantir-ai/
2024-11-27,"Nvidia CEO Jensen Huang Says This Is the ""Next Wave of AI"" -- and He Singled Out 1 Potential Big Winner Other Than Nvidia","If you want to learn where artificial intelligence (AI) could be heading, you'll probably want to pay attention to Nvidia (NVDA 0.66%) CEO Jensen Huang. After all, Huang's company is arguably the most important player in the AI world right now.",The Motley Fool,Positive,ACN|NVDA,CEO,https://www.fool.com/investing/2024/11/27/nvidia-ceo-jensen-huang-says-this-is-the-next-wave/
2024-11-27,"Nvidia: Blackwell In Full Production, As Promised","Nvidia's Blackwell processors, initially delayed, are now in full production. Despite concerns, Nvidia's Q3 Data Center revenue hit record highs, driven by insatiable demand for AI accelerators, outpacing supply constraints. Blackwell outperforms AMD's MI325X, with Nvidia's AI accelerators leading in efficiency and performance, crucial as data centers face power limitations.",Seeking Alpha,Positive,NVDA,paylimitwall,https://seekingalpha.com/article/4740573-nvidia-stock-blackwell-in-full-production-as-promised
2024-11-27,"There's growing skepticism that things have peaked with Nvidia, says Jim Cramer",'Mad Money' host Jim Cramer looks at recent movements in the mega cap stocks and what's behind them.,CNBC Television,Negative,NVDA,cramer,https://www.youtube.com/watch?v=ncRRQzG8wKM
2024-11-26,3 Stocks Set to Gain as Dow Logs 45th Record Close of the Year,"Stocks like AMZN, NVDA and DIS are poised to gain from the ongoing Dow rally.",Zacks Investment Research,Positive,AMZN|DIS|NVDA,,https://www.zacks.com/stock/news/2375631/3-stocks-set-to-gain-as-dow-logs-45th-record-close-of-the-year?cid=CS-STOCKNEWSAPI-FT-analyst_blog|investment_ideas-2375631
2024-11-26,Nvidia unveils AI audio model,CNBC's Deidre Bosa joins 'The Exchange' with the latest details about Nvidia.,CNBC Television,Positive,NVDA,,https://www.youtube.com/watch?v=HhHZ7HfZO4A
2024-11-26,Nvidia unveils AI audio model 'Fugatto',CNBC's Deirdre Bosa joins 'Money Movers' to discuss Nvidia unveiling a new AI audio model.,CNBC Television,Positive,NVDA,,https://www.youtube.com/watch?v=7ImCL59GdLQ
2024-11-26,Why Nvidia Stock Dropped on Monday,"In today's video, I discuss recent updates impacting Nvidia (NVDA 0.68%). To learn more, check out the short video, consider subscribing, and click the special offer link below.",The Motley Fool,Negative,NVDA,podcast,https://www.fool.com/investing/2024/11/26/why-nvidia-stock-dropped-on-monday/
2024-11-26,Nvidia Upgrade: Fortune Favors Patience,"Various investors will have bought Nvidia Corporation stock at different stages of the phenomenal rally over the past two years, hoping they are not too late to profit from the AI. The market is increasingly concerned over whether Nvidia's customers will see justifiable returns on investments, given the underwhelming monetization trends and the struggle of AI start-ups, creating risks for NVDA. However, shareholders should not make the mistake of selling the stock based on these concerns, given the latest industry findings and analogous research.",Seeking Alpha,Neutral,NVDA,paylimitwall,https://seekingalpha.com/article/4740390-nvidia-upgrade-fortune-favors-patience
2024-11-26,Nvidia: Its Competitive Moats Shone Through In Q3,"Nvidia Corporation's Q3 revenue soared to $35.1 billion, a 94% YoY growth, driven by AI adoption across sectors, reiterating my Strong Buy rating with a $200 target. Data Center segment generated $30.8 billion, growing 112% YoY, highlighting AI infrastructure demand and Nvidia's technological lead in accelerated computing and AI-generated software. Enterprise AI and sovereign computing markets are new growth vectors, with Nvidia's software segment nearing a $2 billion annual run rate and major partnerships accelerating adoption.",Seeking Alpha,Positive,NVDA,paylimitwall,https://seekingalpha.com/article/4740383-nvidia-its-competitive-moats-shone-through-in-q3
2024-11-26,Nvidia: Why Skeptics Keep Missing The Point,"Nvidia Corporation's stock has surged, driven by robust AI demand, despite skepticism about AI Capex ROI and competition from AMD's MI300X chip. Cloud providers like AWS, Azure, and Google Cloud show increasing profitability, debunking claims of low AI ROI impacting Nvidia's chip demand. AI's transformative impact extends beyond consumer-facing applications, with accelerated computing becoming essential for traditional data center tasks.",Seeking Alpha,Positive,NVDA,paylimitwall,https://seekingalpha.com/article/4740373-nvidia-why-skeptics-keep-missing-the-point
2024-11-26,1 Unbelievable Metric That Could Make Nvidia Stock a Screaming Buy,"Nvidia (NVDA 0.90%) earnings have become quite the event for investors. Given the company's growth over the past two years, observers are curious about what each quarterly result will bring.",The Motley Fool,Positive,NVDA,,https://www.fool.com/investing/2024/11/26/1-unbelievable-metric-that-could-make-nvidia-stock/
2024-11-26,Nvidia: Stand Back In Awe -- 5 Recent Insights To Help Clarify The Medium Term,"Nvidia Corporation's CEO Jensen Huang has confirmed strong medium- to long-term revenue growth, with potential to double or triple current revenues, reinforcing Nvidia's market leadership. Nvidia's strategic partnerships in India and other countries highlight its expanding AI infrastructure, driving sustained demand for its chips globally. TSM's commitment to doubling chip production capacity by 2025 and Foxconn's new factory in Mexico ensure robust supply to meet Nvidia's high demand.",Seeking Alpha,Positive,NVDA,paylimitwall,https://seekingalpha.com/article/4740360-nvidia-stand-back-in-awe-5-recent-insights-to-help-clarify-the-medium-term
2024-11-26,2 No-Brainer Semiconductor Stocks to Buy Right Now,"With 2024 starting to wind down, it appears it is going to be a very good year for the stock market, with the S&P 500 up about 24% year to date as of this writing. Tech stocks, in particular, have had a good run, with many benefiting from the advent of artificial intelligence (AI).",The Motley Fool,Positive,NVDA|TSM,StocksToWatch,https://www.fool.com/investing/2024/11/26/2-no-brainer-semiconductor-stocks-to-buy-right-now/
2024-11-26,Nvidia: Don't Be Fooled By The Naysayers,"NVIDIA Corporation investors suffered a late pullback last week even as NVDA surged to a new high. Post-earnings profit-taking likely occurred. Should investors be concerned? NVIDIA's magnificent beat-and-raise is expected to be a thing of the past, but that shouldn't deter bullish investors from adding on pullbacks.",Seeking Alpha,Positive,NVDA,paylimitwall,https://seekingalpha.com/article/4740112-nvidia-dont-be-fooled-by-the-naysayers
2024-11-26,"AI Stocks: Tech Giants, Cloud Titans Face 'Show Me' Moment. Trump To Name AI Czar?","President-elect Trump could name an ""AI czar."" Amazon ups Anthropic investment.",Investors Business Daily,Neutral,MSFT|NVDA,,https://www.investors.com/news/technology/artificial-intelligence-stocks-branch-7/
